,id,channel_name,title,keyword,published_at,VideoViews
1436,c6qlgHom1GU,DailyWire+,Are We Now In A Covid Panic? | The Ben Shapiro Show Ep. 1065,Covid,2020-08-03T17:00:12Z,244869
1437,5NZDS9GUHJk,DailyWire+,"Kanye West Gives Impassioned Anti-Abortion Speech: ""My Dad Wanted To Abort Me""",Abortion,2020-07-20T23:45:01Z,86361
1438,uC0_G1WF8-s,DailyWire+,How China CHEATS in the Global Economy,Economy,2020-07-17T23:04:25Z,39841
1439,z9_Rpp7chPw,DailyWire+,"Trump DEFENDS ""Gun Couple"" And CRUSHES Reporter's Question",Gun,2020-07-15T21:34:01Z,213061
1440,AMQAFvW-fVg,DailyWire+,"If We Don't Close Schools For The Flu, Why For COVID? | The Matt Walsh Show Ep. 520",Covid,2020-07-14T18:00:13Z,104156
1441,MAhOtIC8q_Q,DailyWire+,Here is THE TRUTH about Police Shootings in America...,Shooting,2020-07-09T00:30:01Z,38968
1442,L3YDDDhCIno,DailyWire+,Covid Is The Campaign | The Michael Knowles Show Ep. 572,Covid,2020-07-01T16:00:11Z,74388
1443,W7P2E9yStx4,DailyWire+,Supreme Court Strikes Down Louisiana Abortion Restrictions,Abortion,2020-07-01T00:00:03Z,27158
1444,Qze9fGnqmSg,DailyWire+,@BenShapiro SLAMS Justice Roberts For STRIKING DOWN Another Pro-Life Law,Pro-life,2020-06-30T20:24:06Z,30530
1445,R1OuCAHFGCI,DailyWire+,BACKFIRE: Violence Erupts Inside CHAZ/CHOP; Shootings Increase In NY,Shooting,2020-06-22T21:00:15Z,153740
1446,TTmwNFQs8oo,DailyWire+,"Atlanta Riots Over Justified Police Shooting Of An Armed, Violent Man | The Matt Walsh Show Ep. 504",Shooting,2020-06-15T18:00:12Z,45862
1447,yyOUV4HsFrw,DailyWire+,Leftism Is A Religion Of Self-Loathing | The Matt Walsh Show Ep. 498,Religion,2020-06-05T18:00:12Z,62864
1448,LrEenld07e0,DailyWire+,The Religion Of Wokeness | The Ben Shapiro Show Ep. 1024,Religion,2020-06-04T17:00:12Z,146483
1449,_O-u1SwatAk,DailyWire+,MEDIA HYPOCRISY: NY Governor Cuomo Gets Royal Treatment while CNN Ignores Covid Death Count,Covid,2020-05-23T16:30:01Z,37445
1450,btiULEEw4o0,DailyWire+,DISGUSTING: Planned Parenthood Receives $80M From #COVID Relief Bill,Covid,2020-05-21T00:15:01Z,20401
1451,7RF35XKV0zs,DailyWire+,"The Democrats Are Covering Up Obamagate, Refuse To Open Economy | The Andrew Klavan Show Ep. 895",Economy,2020-05-13T19:00:11Z,101303
1452,JN9L1fN_Z74,DailyWire+,Leftists ENRAGED Over Trump's COVID-19 Immigration Move,Immigration,2020-04-22T19:40:15Z,28198
1453,UffQZLSlKy8,DailyWire+,Ben and Steve Forbes Talk the Economy and Getting America Back to Work,Economy,2020-04-19T15:00:18Z,24556
1454,qwCQ4g9N-pE,DailyWire+,The American Economy is Crashing (6.6 MILLION Unemployment Claims Last Week),Economy,2020-04-02T22:15:01Z,15590
1455,Z1vyU5qVPTE,DailyWire+,SHAPIRO: China Destroyed The World Economy,Economy,2020-04-02T21:29:03Z,337375
1456,Q8n5oxUi9bU,DailyWire+,"Churches Closed, Abortion Clinics Open | The Matt Walsh Show Ep. 456",Abortion,2020-03-31T18:00:12Z,28221
1457,AyqDFoO2Hsg,DailyWire+,THIS Is How Pro-Lifers Can Make A Difference,Pro-life,2020-03-28T00:00:04Z,16793
1458,Po5bnZevXF8,DailyWire+,Destroying The Economy Is Not A Good Way To Save Lives | The Matt Walsh Show Ep. 451,Economy,2020-03-24T18:00:10Z,21475
1459,OFEe7r5y6vk,DailyWire+,Celeb Gives Bond Villain Speech At Abortion Rally,Abortion,2020-03-06T23:16:55Z,120691
1460,QGfWVkyFtHA,DailyWire+,The Abortion Supreme Court Case You Probably Haven't Heard About,Abortion,2020-03-05T22:30:00Z,42811
1461,Ne4nj7OzxyY,DailyWire+,INSANE: Rashida Tlaib And Leftists Cheer Over Abortion,Abortion,2020-03-05T21:15:01Z,47428
1462,jOWdZR_gfWk,DailyWire+,Abortion Enthusiasts Lose Their Minds | The Matt Walsh Show Ep. 438,Abortion,2020-03-05T19:00:10Z,29155
1463,JppVNkU_hlE,DailyWire+,Can The Coronavirus Crash The Economy?,Economy,2020-03-04T19:28:31Z,13061
1464,WtKepcjJ4-8,DailyWire+,DISGUSTING: Two Young Women Post TikTok Video On Getting An Abortion,Abortion,2020-02-28T22:30:01Z,205245
1465,W9gQovB9Az8,DailyWire+,Coronavirus Kills The Economy | The Michael Knowles Show Ep. 500,Economy,2020-02-25T17:00:11Z,122093
1466,HhK-9YsGWtw,DailyWire+,BERNIE IS #TRIGGERED THAT MIKE BLOOMBERG IS RICH!,Rich,2020-02-19T23:30:00Z,49280
1467,JwCaNfqFNeE,DailyWire+,Abortion is a Tool of the Eugenics Movement,Abortion,2020-02-19T00:00:02Z,32790
1468,_0gxO2m39UY,DailyWire+,WOW: Obama Claims Credit For Trump's Economy,Economy,2020-02-18T22:00:05Z,112045
1469,EMvRM5oTjJc,DailyWire+,Joe Biden Wants To Ban Imaginary Firearms,Firearm,2020-02-11T20:03:20Z,72110
1470,WuvWfaDZk3o,DailyWire+,DISGUSTING: Pete Buttigieg Defends LATE TERM Abortion,Abortion,2020-02-08T00:45:00Z,43704
1471,P_grK3c1HmU,DailyWire+,Ben Shapiro DESTROYS Buttigieg On Abortion And Paying Doctors,Abortion,2020-02-07T22:00:03Z,120605
1472,Xg47HHROuzw,DailyWire+,The Barbaric Extremism Of The Democratic Party | The Matt Walsh Show Ep. 422,Extremism,2020-02-07T18:30:11Z,36423
1473,8RVooYlyl20,DailyWire+,Ben Shapiro DESTROYS Greta's CRAZY Climate Change Arguments,Climate,2020-01-23T23:30:01Z,3082970
1474,yfxOmo1rPsQ,DailyWire+,The Pro-Life President | The Michael Knowles Show Ep. 483,Pro-life,2020-01-23T17:03:31Z,91391
1475,nko9K-lW8ac,DailyWire+,Democrats And Media Devastated By Peaceful Gun Rights Rally | The Matt Walsh Show Ep. 409,Gun,2020-01-21T18:37:15Z,37780
1476,nUtffQoVzkY,DailyWire+,Shooting Down The Narrative | The Michael Knowles Show Ep. 481,Shooting,2020-01-21T17:02:42Z,87982
1477,6kNL2XJqVxI,DailyWire+,MEDIA BIAS: Virginia Gun Rally vs. Women's March (Ben Shapiro),Gun,2020-01-20T19:45:01Z,142167
1478,H-L9fuZ4gRo,DailyWire+,Daily Mail Claims Women NEVER Regret Aborting Their Child...,Abortion,2020-01-16T23:00:04Z,24474
1479,du6Qd2mTeXA,DailyWire+,When The Pro Abortion Movement Takes Off The Mask | The Matt Walsh Show Ep. 406,Abortion,2020-01-16T18:42:14Z,32438
1480,PzyXs92LFDk,DailyWire+,TV Star's Shameless Defense Of Abortion,Abortion,2019-12-11T00:30:00Z,42880
1481,riu4HSrHaWw,DailyWire+,"Actress Insists She's Happy After Abortion, Nobody Is Fooled | The Matt Walsh Show Ep. 387",Abortion,2019-12-10T18:30:09Z,28703
1482,CHTw8pYoKx0,DailyWire+,"MSM Covers Up Latest Potential Terror Attack (Pensacola, Florida)",Terrorism,2019-12-09T23:56:33Z,21007
1483,1Dbhc6xupcs,DailyWire+,The Most Effective Pro-Life Messaging,Pro-life,2019-12-08T16:00:00Z,22761
1484,pLPmKtTQoIk,DailyWire+,Climate Protesters Officially Cross The Line | The Matt Walsh Show Ep. 378,Climate,2019-11-25T18:30:09Z,15700
1485,tPC61Pce1aY,DailyWire+,"Student Quizzes Ben Shapiro:  ""Is there any societal benefit that justifies abortion?""",Abortion,2019-11-22T03:09:39Z,56057
1486,N0jbAsogO04,DailyWire+,"Crushing Warren's Propaganda And Lies (On Abortion, The Wealth Tax, And More)",Abortion,2019-11-21T22:15:00Z,12107
1487,hNBLAtpaZzo,DailyWire+,"LOL: Eric Swalwell Lets Out Extremely Loud Fart On National Television, Then Denies It #FARTGATE",Extremism,2019-11-19T23:05:55Z,113607
1488,M6SnrPMJt9c,DailyWire+,Rich Lowry | The Ben Shapiro Show Sunday Special Ep. 77,Rich,2019-11-17T13:00:03Z,40282
1489,Paok_tNu4L4,DailyWire+,Why SCOTUS' Gun Ruling Is Damaging,Gun,2019-11-16T01:09:17Z,60031
1490,optayT-0wbQ,DailyWire+,Why Gender Ideology Is A Horrifying Religion,Religion,2019-11-13T18:47:28Z,45425
1491,a2ohfH0KHj4,DailyWire+,Our Civil War of Religion | The Michael Knowles Show Ep. 449,Religion,2019-11-13T14:45:11Z,46089
1492,Z6oi-dHemkc,DailyWire+,Eat The Rich | The Ben Shapiro Show Ep. 894,Rich,2019-11-11T18:13:56Z,150674
1493,8KNb-XQI_GA,DailyWire+,"NO, Abortion Isn't Justified To ""Stop"" Crime",Abortion,2019-11-09T19:00:00Z,97128
1494,aFfvZM6DxgA,DailyWire+,"Shapiro: NO, Abortion Isn't Justified To ""Stop"" Crime",Abortion,2019-11-08T21:29:08Z,130223
1495,Bvm26ZgaAys,DailyWire+,Why Kanye's Pro-Life Advocacy Is Significant,Pro-life,2019-10-28T21:52:58Z,36679
1496,a2njhiDJLL4,DailyWire+,The Left Targets Trump For Killing ISIS Leader,ISIS,2019-10-28T21:48:28Z,88498
1497,UBS2X7N1J5E,DailyWire+,"ISIS Is Dead, Kanye Is Alive | The Michael Knowles Show Ep. 439",ISIS,2019-10-28T16:40:11Z,64681
1498,f22SHrQB7X8,DailyWire+,Michael Knowles SMASHES Clay Aiken On Climate Change,Climate,2019-10-28T16:24:05Z,906799
1499,HDNcqSYwKgg,DailyWire+,Will SCOTUS Overturn Roe Vs. Wade?,Roe,2019-10-25T14:00:03Z,15456
1500,OPW_l91e5Vw,DailyWire+,Watch Climate Protestors Face Real Consequences,Climate,2019-10-17T23:10:57Z,37491
1501,Rq-OoE1uEHI,DailyWire+,SCOTUS Is Set To Hear A Huge Abortion Case,Abortion,2019-10-09T13:00:04Z,8619
1502,pSkM_kdyuPk,DailyWire+,Where Is The Pro-Life Battle Right Now?,Pro-life,2019-09-30T16:06:44Z,14946
1503,Y8WlxjQtBUw,DailyWire+,Insane: AOC Just Tripled The Poverty Line,Poverty,2019-09-27T21:34:06Z,62049
1504,5bT5BgojL2Y,DailyWire+,The Real Climate Polluting Villains,Climate,2019-09-25T00:20:59Z,15864
1505,LeUfc0Lmn5A,DailyWire+,Bernie Ups The Ante On Taxing The Rich,Rich,2019-09-24T22:49:52Z,22632
1506,20IRkFIeADU,DailyWire+,Climate Alarmism Is Child Abuse | The Matt Walsh Show Ep. 338,Climate,2019-09-24T19:00:13Z,27149
1507,cqOR9Pt5ZPE,DailyWire+,The Religion Of Environmentalism | The Matt Walsh Show Ep. 336,Religion,2019-09-20T19:00:10Z,25969
1508,TsctxEtXML0,DailyWire+,Biden's Epic Fail At Climate Townhall,Climate,2019-09-05T22:37:57Z,63522
1509,ed6XuR8yGaA,DailyWire+,Democrats’ Climate Catastrophe | The Michael Knowles Show Ep. 410,Climate,2019-09-05T19:17:36Z,50173
1510,B4tbHS9TDIQ,DailyWire+,Walmart Solves Mass Shootings | The Matt Walsh Show Ep. 324,Shooting,2019-09-04T18:54:08Z,31425
1511,yZupk70Da0s,DailyWire+,Gun Confiscation By Another Name | The Matt Walsh Show Ep. 323,Gun,2019-09-03T18:53:34Z,34428
1512,HmPn02UGVvc,DailyWire+,This Is Why Bernie Is Wrong On Climate Change,Climate,2019-08-23T22:32:20Z,79318
1513,ip4aJKsJXT8,DailyWire+,Does Trump Want More Gun Regulation?,Gun,2019-08-14T23:27:22Z,15678
1514,8YFJRRcd20o,DailyWire+,Is Immigration Enforcement White Supremacy? | The Ben Shapiro Show Ep. 836,Immigration,2019-08-09T17:08:36Z,193417
1515,_6KL9L5Gdvs,DailyWire+,Swamp Gas | The Andrew Klavan Show Ep. 736,Gas,2019-07-23T19:30:36Z,42913
1516,el3RXgE-PZ4,DailyWire+,Advice For An Unwanted Pregnancy,Pregnancy,2019-07-19T20:47:46Z,61388
1517,idrTPxJP74U,DailyWire+,The Largest Teachers Union In America Comes Out For Abortion | The Matt Walsh Show Ep. 292,Abortion,2019-07-10T19:15:54Z,35701
1518,ok1ZbXULGt8,DailyWire+,Student Loan Forgiveness Is Welfare For The Rich | The Michael Knowles Show Ep. 371,Rich,2019-06-25T19:58:59Z,40240
1519,MiRyD4rKEhk,DailyWire+,Did Trump Rape That Woman? | The Michael Knowles Show Ep. 370,Rape,2019-06-24T19:49:43Z,38157
1520,Av-PTU3uHhE,DailyWire+,Wrecking AOC's Immigration Tweet,Immigration,2019-06-18T22:15:01Z,101189
1521,Y02OPZoLWTI,DailyWire+,Can Trump Actually Deport Millions Of Illegals? | The Michael Knowles Show Ep. 367,Deportation,2019-06-18T20:23:14Z,31013
1522,c-7ef9Zv2fE,DailyWire+,Trump Wins Big With Mexico | The Michael Knowles Show Ep. 363,Mexico,2019-06-11T20:04:41Z,33780
1523,UKnBxXr84iQ,DailyWire+,Miley Cyrus' Bizarre Abortion Cake,Abortion,2019-06-05T18:37:33Z,129390
1524,3K2B1pv_8us,DailyWire+,Pro-Life Win: Baby Born At 23 Weeks Survives,Pro-life,2019-05-31T22:10:52Z,23443
1525,c_soPc2ahKc,DailyWire+,Why The Left Now Calls Abortion Morally Good,Abortion,2019-05-22T21:28:01Z,78478
1526,ntCFUA0YSSY,DailyWire+,Three Cheers For Abortion! | The Ben Shapiro Show Ep. 786,Abortion,2019-05-22T17:38:27Z,131598
1527,CuHW9RLWd4k,DailyWire+,Wrecking The Constitutional Argument For Abortion,Abortion,2019-05-17T17:49:05Z,28977
1528,armJNukb1U4,DailyWire+,Will Roe v. Wade Be Overturned?,Roe,2019-05-17T17:33:14Z,10020
1529,_RSTMvt3AqM,DailyWire+,What SCOTUS Should Do With Abortion & Affirmative Action,Abortion,2019-05-17T17:32:21Z,8226
1530,Q08UrrfhiMA,DailyWire+,Should There Be Exceptions For Abortion?,Abortion,2019-05-16T21:11:35Z,13002
1531,tmUXMWJph_o,DailyWire+,The Two Perspectives On The New Abortion Laws,Abortion,2019-05-16T20:38:28Z,35009
1532,Tk1EJOx5dkc,DailyWire+,Abortion Wars | The Ben Shapiro Show Ep. 782,Abortion,2019-05-16T18:49:15Z,154320
1533,VeLvil5d268,DailyWire+,Why Pro-Lifers Can't Support Rape Exceptions | The Matt Walsh Show Ep. 261,Pro-life,2019-05-16T16:05:19Z,46471
1534,ZNk6IBX7yVc,DailyWire+,Roe V. Wade Is Probably Going Back To SCOTUS,Roe,2019-05-15T21:57:34Z,12959
1535,naduRufi-gQ,DailyWire+,Is The New Pro-Life Law Unjust?,Pro-life,2019-05-15T21:19:58Z,19346
1536,ZnB_ql8Od-U,DailyWire+,The Future of Roe v Wade | The Andrew Klavan Show Ep. 703,Roe,2019-05-15T19:12:01Z,40030
1537,PK3niB1VAmQ,DailyWire+,Why Abortion Doesn't Work As A Women's Rights Issue,Abortion,2019-05-13T20:47:22Z,12121
1538,vCt6-gofO3k,DailyWire+,You're Not Allowed To Be Pro-Life In Hollywood,Pro-life,2019-05-13T20:17:04Z,13647
1539,4RpV_LylisE,DailyWire+,FULL SPEECH: Matt Walsh Speaks At Pro-Life Rally In Philly,Pro-life,2019-05-11T01:56:28Z,36588
1540,5EG39-Ae774,DailyWire+,Pro-Choice Advocates Failed To Show At The Pro-Life Rally,Pro-life,2019-05-10T23:18:26Z,16165
1541,AcoN8HgH03o,DailyWire+,Pro-Life Rally In Philly Is A Huge Success | The Matt Walsh Show Ep. 257,Pro-life,2019-05-10T22:37:03Z,46909
1542,Tm_DDl96stU,DailyWire+,Democratic Representative Provokes Pro-Life Rally  | The Matt Walsh Show Ep. 254,Pro-life,2019-05-07T16:01:03Z,34638
1543,W4kFrUwIzB8,DailyWire+,All Politics is About Religion | The Michael Knowles Show Ep. 343,Religion,2019-05-06T19:55:20Z,25594
1544,UKjZu04EKaY,DailyWire+,The Only 3 Things We Need To Know About Immigration,Immigration,2019-05-05T19:00:03Z,41459
1545,PrfBiZdg2mU,DailyWire+,Venezuela Teaches Media What Happens When Only Government Has Guns,Gun,2019-05-01T20:59:21Z,19298
1546,rtIS9UrAYN0,DailyWire+,The Left's Awful Take On The Synagogue Shooting,Shooting,2019-04-29T20:40:57Z,31400
1547,MGSMQJx-bdY,DailyWire+,Uber Driver Fired For Refusing To Take Woman To Abortion,Abortion,2019-04-24T21:14:26Z,16118
1548,mt9vBDqDKRU,DailyWire+,Heroic Uber Driver Refuses To Bring Woman To Abortion Appointment | The Matt Walsh Show Ep. 246,Abortion,2019-04-24T16:09:37Z,27259
1549,B6W11MN3UqI,DailyWire+,"FULL SPEECH: Michael Knowles on ""Immigration and The Wall"" at Cal State Los Angeles",Immigration,2019-04-23T23:59:28Z,137221
1550,c0rlExejB-E,DailyWire+,Whiteness Is Extremely Problematic,Extremism,2019-04-23T20:50:51Z,18555
1551,VkgeDjxDTS8,DailyWire+,How to Handle the Socioeconomic Argument for Abortion,Abortion,2019-04-12T14:21:06Z,5768
1552,ePPb7mCTBvk,DailyWire+,Why Immigration Is A Big Problem For 2020 Democrat Candidates,Immigration,2019-04-12T14:18:52Z,5680
1553,JC3bzryVg94,DailyWire+,Southern Poverty Law Center In Big Trouble,Poverty,2019-04-10T22:22:53Z,138697
1554,L32m5VVuqnQ,DailyWire+,The Immigration Conflagration | The Ben Shapiro Show Ep. 755,Immigration,2019-04-09T18:49:31Z,137834
1555,PXjkuMxwh10,DailyWire+,You Don't Need Religion To Know Abortion Is Evil,Abortion,2019-04-04T14:21:38Z,25338
1556,3XCoMez2OkA,DailyWire+,The Pitfalls Of Bringing Religion Into Political Debate,Religion,2019-03-31T19:00:02Z,17161
1557,erGBC80llE0,DailyWire+,The Individual Mandate Is The Achilles Heel Of Obamacare,Obamacare,2019-03-29T14:29:13Z,4590
1558,5pr2Z969Kts,DailyWire+,Another Peaceful Pro-Lifer Brutally Assaulted By Pro-Abortion Extremist | The Matt Walsh Show Ep 227,Pro-life,2019-03-28T19:43:10Z,44471
1559,iBfcT1dYRRo,DailyWire+,Bridging The Gap Between Science & Religion,Religion,2019-03-24T15:00:02Z,16432
1560,rGJfb7OS1yA,DailyWire+,New Zealand's New Gun Policy Won't Curb Violence Because Gun Buybacks Don't Work,Gun,2019-03-22T14:16:43Z,13779
1561,FywbRB5ZQFE,DailyWire+,Beto Comes Out For Third Trimester Abortions | The Matt Walsh Show Ep. 221,Abortion,2019-03-20T19:55:32Z,30494
1562,0ChfuirizlA,DailyWire+,Should Doctors Face Imprisonment For Abortion?,Abortion,2019-03-14T21:24:25Z,17478
1563,XlQMNIATiYA,DailyWire+,How Men Are Silenced In The Abortion Debate | The Matt Walsh Show Ep. 216,Abortion,2019-03-12T17:31:25Z,27399
1564,GDjqvpMX5n8,DailyWire+,Alexandria Ocasio-Cortez Wows With Her Lack Of Knowledge on America and the Free Market,Market,2019-03-12T15:40:21Z,20852
1565,5vahtbPLHNk,DailyWire+,The Tyrannical Hypocrisy Of Climate Alarmists,Climate,2019-03-09T00:25:08Z,13553
1566,LMqDRtrE2hI,DailyWire+,Football Player Acquitted Of Rape Charges But His Life Is Still Destroyed | Matt Walsh Show Ep. 213,Rape,2019-03-07T20:56:56Z,33060
1567,6KQTaueKFHs,DailyWire+,Alexandria Ocasio-Cortez's Enormous Carbon Footprint Exposed,Carbon,2019-03-06T16:52:51Z,11201
1568,AZej2zEBivg,DailyWire+,Alexandria Ocasio-Cortez's Latest Insanity on Climate Change and War,Climate,2019-03-06T16:50:32Z,13493
1569,rjqldiGuQEg,DailyWire+,Ocasio's Hypocrisy on Climate Change and Fossil Fuels,Climate,2019-03-05T16:22:50Z,10641
1570,BacZP-N24EA,DailyWire+,Democrat Extremism Strikes Again with more Anti-Semitism from Ilhan Omar,Extremism,2019-03-01T23:54:33Z,57006
1571,hjX00B608U8,DailyWire+,Walsh Baffled At Post-Marriage Soap Inflation,Inflation,2019-02-28T17:19:56Z,6402
1572,Gjckm0Xh_I8,DailyWire+,Brutal Poem Perfectly Sums Up Abortion,Abortion,2019-02-27T16:23:21Z,23553
1573,DUfbWW-7eBs,DailyWire+,Alexandria Ocasio-Cortez Cooks While Moralizing About The Next Generation and Climate Change,Climate,2019-02-26T16:58:58Z,11463
1574,2Z8rSnnZN9I,DailyWire+,Forget the Left's Apocalyptic Warnings About Climate Change - Earth Will Survive Us,Climate,2019-02-26T16:56:36Z,6825
1575,0RsH0rQzsyA,DailyWire+,Poet Roderick Falconer Highlights the Brutal Reality Of An Abortion As You've Never Heard It,Abortion,2019-02-25T22:47:38Z,42622
1576,5co7Mzeg558,DailyWire+,Climate Alarmism Has Turned Into A Cult | The Matt Walsh Show Ep. 205,Climate,2019-02-25T17:38:47Z,22685
1577,dvaSkAPjhO8,DailyWire+,ISIS Brides Now Want To Return To The USA,ISIS,2019-02-22T16:10:18Z,15097
1578,9wzT2J-2MQg,DailyWire+,Ben Shapiro Explains Abortion vs. Gun Control,Gun,2019-02-14T02:19:46Z,177848
1579,9wzT2J-2MQg,DailyWire+,Ben Shapiro Explains Abortion vs. Gun Control,Abortion,2019-02-14T02:19:46Z,177849
1580,RlQZS4nGBGA,DailyWire+,How To Argue Against Abortion,Abortion,2019-02-13T02:19:33Z,42461
1581,j4TPz6zmcM4,DailyWire+,Bill Nye Doesn't Know Science On Abortion,Abortion,2019-02-13T01:09:06Z,18028
1582,vQvTWQKQs7Q,DailyWire+,The Left's Main Issue Is Their False Religion,Religion,2019-02-12T01:25:23Z,19138
1583,Riw6qqT1OhM,DailyWire+,Kamala Traps Herself With Abortion Tweet,Abortion,2019-02-06T23:38:29Z,61400
1584,NAarsb4e6Q0,DailyWire+,Media Suddenly Won't Report Unsubstantiated Rape Allegations | The Matt Walsh Show Ep. 191,Rape,2019-02-05T17:37:50Z,34158
1585,96LrDpwzw3w,DailyWire+,Dems Desperate To Distract From Abortion Infanticide,Abortion,2019-02-04T23:58:19Z,12400
1586,iwKjTYVdQtQ,DailyWire+,Eat The Rich! | The Ben Shapiro Show Ep. 708,Rich,2019-02-01T18:52:06Z,216062
1587,_qFbDvoY1Nk,DailyWire+,Dems Are Making Same Abortion Mistake As GOP,Abortion,2019-01-31T23:28:31Z,15839
1588,I9_RXNdJUPs,DailyWire+,Fourth Trimester Abortion | The Michael Knowles Show Ep. 290,Abortion,2019-01-31T21:43:10Z,29210
1589,R133cZuh-Nk,DailyWire+,Dems Double Down On Partial-Birth Abortion,Abortion,2019-01-30T23:57:37Z,11217
1590,Vg8mMGZKhiM,DailyWire+,Here's Why Immigrants Should Assimilate,Immigration,2019-01-29T01:22:06Z,7516
1591,a-JCpvQFqQk,DailyWire+,Elizabeth Warren Wants Rich To Pay Off Our Student Loans | The Matt Walsh Show Ep. 185,Rich,2019-01-28T17:36:40Z,35622
1592,C5Zu159e5s8,DailyWire+,What The Left Won't Tell You About The Pro-Life Movement,Pro-life,2019-01-25T16:00:01Z,158274
1593,-aTj7Dc94V8,DailyWire+,"Lethal Injections Ok For Abortions, But Not Criminals?",Abortion,2019-01-25T01:04:50Z,41253
1594,T-P0g4zyRrI,DailyWire+,Late Term Abortions Won't Save The Mother,Abortion,2019-01-23T23:27:54Z,19921
1595,genWpUqgkLE,DailyWire+,Why WH Leaks Are Extremely Dangerous,Extremism,2019-01-15T22:42:04Z,21031
1596,LA_Ba86dTZI,DailyWire+,Feminist Brags About Her Abortion To Children | The Matt Walsh Show Ep. 169,Abortion,2019-01-04T18:49:27Z,45015
1597,dodrxU4Lgn4,DailyWire+,Democrats Designed Obamacare For Failure,Obamacare,2018-12-17T23:37:58Z,62192
1598,C4i5cWI_yR0,DailyWire+,The Media Exploits The Tragic Death Of An Immigrant Child | The Matt Walsh Show Ep. 162,Immigration,2018-12-14T18:36:38Z,23372
1599,9dMeQTvE4EE,DailyWire+,Washington Post Knocks Shapiro For Pro-Life Speech,Pro-life,2018-12-13T00:38:32Z,97552
1600,zZIyRiAHJ0o,DailyWire+,There Is No Pro-Life Party,Pro-life,2018-12-12T00:05:46Z,7872
1601,W7JqsErPAv8,DailyWire+,Kavanaugh Votes With Leftists On Abortion,Abortion,2018-12-10T23:24:03Z,168603
1602,BF2QpR5UJBo,DailyWire+,I Was Wrong About Police Shootings,Shooting,2018-12-06T22:42:56Z,27095
1603,_v_mKEe_gfw,DailyWire+,Another Innocent Man Gunned Down By Police | The Matt Walsh Show Ep. 157,Gun,2018-12-06T18:29:46Z,34378
1604,LtRljKf_c6U,DailyWire+,Does This Little Mermaid Song Promote Rape?,Rape,2018-12-04T22:55:32Z,8942
1605,Z8ZYCmKg5Oc,DailyWire+,The Truth About Immigration,Immigration,2018-11-29T00:27:46Z,13282
1606,Hj7NzshpJzo,DailyWire+,Judge Refuses To Enforce Immigration Law,Immigration,2018-11-21T01:22:42Z,24202
1607,bNT-CvUyLAo,DailyWire+,Canadian Immigrants Vote Conservative,Immigration,2018-11-18T20:00:02Z,34567
1608,_JrRUUIMabc,DailyWire+,USA Gun Control Vs. Australia,Gun,2018-11-17T01:11:11Z,269747
1609,RgnUTR8dLMU,DailyWire+,Fox Host's Family Terrorized By Mob,Terrorism,2018-11-09T00:41:39Z,178193
1610,hrL-p7Qmcc4,DailyWire+,Left Has No Plan For Immigrant Caravan,Immigration,2018-11-03T00:09:51Z,16435
1611,r8Qx2LlNllg,DailyWire+,Birthright Citizenship Is Clearly Madness,Citizenship,2018-10-31T23:26:55Z,6936
1612,5UY4JeqxjY8,DailyWire+,What's Wrong With Birthright Citizenship | The Michael Knowles Show Ep. 243,Citizenship,2018-10-31T00:00:30Z,54698
1613,D2P7TZthC5g,DailyWire+,Of Course We Should End Birthright Citizenship For Illegals | The Matt Walsh Show Ep. 134,Citizenship,2018-10-30T23:46:55Z,31423
1614,7c-w0Xr5tzA,DailyWire+,Birthright Citizenship Is Bad Policy,Citizenship,2018-10-30T23:32:29Z,176545
1615,fFMKqc7VYn4,DailyWire+,Why Mass Shootings Happen | The Matt Walsh Show Ep. 133,Shooting,2018-10-29T17:56:09Z,29941
1616,4tLpyT44BHU,DailyWire+,Democrat Fails Lesson In Free Market,Market,2018-10-24T21:54:58Z,24327
1617,_GobgW2U3vQ,DailyWire+,Is Abortion Needed For Population Control?,Abortion,2018-10-23T20:13:59Z,80413
1618,VQlsn4QAVhQ,DailyWire+,Is There A Moral Case for Abortion?,Abortion,2018-10-17T22:34:47Z,9996
1619,pd4gBnVWF9Q,DailyWire+,Leftist Man Kicks Pro-Life Woman,Pro-life,2018-10-04T23:04:05Z,55398
1620,sDkhl4vAHM8,DailyWire+,How Should Media Cover Shootings?,Shooting,2018-09-30T15:00:05Z,15426
1621,8WUL57xiNPY,DailyWire+,Chelsea: It's Un-Christian To Be Against Abortion,Abortion,2018-09-17T23:51:55Z,29284
1622,m0FqwViSiwQ,DailyWire+,How To Protect Men From False Rape Accusations | The Matt Walsh Show Ep. 102,Rape,2018-09-12T17:26:44Z,15091
1623,bRNbhXprGEQ,DailyWire+,Leftists Hysterical Over Vulnerable Roe,Roe,2018-09-10T22:40:05Z,11327
1624,eeOrBpc_LZw,DailyWire+,"Shocking Truth About The ""Rape Epidemic""",Rape,2018-09-09T22:00:01Z,27382
1625,UnmHCCH_yTM,DailyWire+,Abortion: Self-Care Or Self-ish?,Abortion,2018-08-30T23:29:35Z,10891
1626,baEVqPAqCmw,DailyWire+,Why The Allegations Against Pope Francis Are Extremely Credible | The Matt Walsh Show Ep. 92,Extremism,2018-08-28T17:23:21Z,23193
1627,BRCOap9eBmc,DailyWire+,Literally Hitler Deports A Nazi | The Michael Knowles Show Ep. 204,Deportation,2018-08-21T20:59:27Z,32173
1628,tijdiqiSPi0,DailyWire+,Andrew Klavan's Leftese Dictionary: G is for Gun,Gun,2018-08-21T15:00:05Z,232014
1629,oYxTXVs2elY,DailyWire+,Abortion Is Legalized Discrimination,Abortion,2018-08-07T00:13:51Z,11656
1630,Y3Kn8EGvzf0,DailyWire+,Christianity Is The Most Persecuted Religion,Religion,2018-07-19T23:57:34Z,20525
1631,PMhn57m_Mpc,DailyWire+,Should Trump Get Credit For The Economy?,Economy,2018-07-18T23:28:36Z,6777
1632,9bKOQ-LlbOw,DailyWire+,Should Religion Be Separate From Politics?,Religion,2018-07-12T23:30:27Z,8221
1633,UEHMjAtUZ_w,DailyWire+,Is Tomi Right About Roe Vs. Wade?,Roe,2018-07-12T23:30:08Z,18292
1634,Se2VTF8A-Hs,DailyWire+,The Left Won't Stop Pushing Its Religion On Us | The Matt Walsh Show Ep. 60,Religion,2018-07-12T17:25:39Z,70772
1635,6wbiFv7aUbE,DailyWire+,What Trump's SCOTUS Pick Says About Obamacare,Obamacare,2018-07-10T23:45:55Z,7036
1636,JTdkOZaN_nE,DailyWire+,"Abortion Is More Than A ""Social Issue""",Abortion,2018-07-10T23:03:07Z,6867
1637,izzLYmp9FKQ,DailyWire+,Will SCOTUS Nominee Overturn Roe Vs. Wade?,Roe,2018-07-09T23:52:09Z,26008
1638,0wj_MrAzdvg,DailyWire+,Abortion Is Not A Women's Health Issue,Abortion,2018-07-09T18:47:58Z,9760
1639,X3Ogq_riyk4,DailyWire+,Armed Elites Rail Against Guns,Gun,2018-06-29T16:48:40Z,7061
1640,KPfzpFJGMuM,DailyWire+,Abortion Is The Left's Sacrament,Abortion,2018-06-29T01:22:05Z,7557
1641,uz8EKo5DUds,DailyWire+,Pro-Life Organizations Don't Have To Support Abortion,Abortion,2018-06-27T23:17:18Z,6125
1642,q2tJAOMTtKs,DailyWire+,Leftists Terrorize Female Republicans,Terrorism,2018-06-26T00:17:15Z,11388
1643,GrwQBxykDZQ,DailyWire+,There Isn’t Any Nice Or Pleasant Way To Enforce Our Immigration Law | The Matt Walsh Show Ep. 52,Immigration,2018-06-22T17:33:41Z,56354
1644,O2pcE6msmUg,DailyWire+,Democrats Want To Solve Climate Change With Socialism,Climate,2018-06-21T00:17:49Z,13130
1645,z6Jh6oxkBfs,DailyWire+,The Immigration Wars Heat Up | The Ben Shapiro Show Ep. 563,Immigration,2018-06-19T19:06:47Z,269781
1646,wPFH97Qtqww,DailyWire+,Dem Uses Pepper Spray On Himself For Gun Control,Gun,2018-06-15T00:48:23Z,51266
1647,J61PCwo1_AI,DailyWire+,Southern Poverty Law Center Calls Ben Shapiro Hateful,Poverty,2018-06-14T00:38:07Z,12849
1648,mqmTOOJeLJc,DailyWire+,How Can We Prevent Mass Shootings?,Shooting,2018-06-02T01:13:48Z,7722
1649,Ws1nlyRX7sY,DailyWire+,Activist Arrested For Filming Muslim Rape Trial,Rape,2018-05-30T15:22:17Z,24306
1650,uaEG7_6cyPY,DailyWire+,The Left's Satanic Enthusiasm For Abortion | The Matt Walsh Show Ep. 38,Abortion,2018-05-29T17:20:00Z,67232
1651,3iKOXS9rJgQ,DailyWire+,Should You Date Outside Your Religion?,Religion,2018-05-27T19:00:01Z,41148
