,id,channel_name,title,keyword,published_at,VideoViews
828,I8AM4u7StbU,Fox News,Climate activists cause global mayhem in latest swing of protests,Climate,2023-05-27T18:00:12Z,53148
829,GN6S_j8hfRc,Fox News,Drive-by shooting caught on camera during TV interview,Shooting,2023-05-24T18:34:12Z,73537
830,gseNWAdsUuE,Fox News,Trey Gowdy: Economic opportunity is not an asylum claim,Asylum,2023-05-23T02:00:20Z,23909
831,fK8Ejz8Lx8w,Fox News,Hannity: This is an extreme policy,Extremism,2023-05-18T02:15:06Z,67543
832,Sj351vQOlu0,Fox News,Biden: Poor kids are just as bright and talented as White kids #shorts,Poor,2023-05-17T19:00:20Z,207624
833,SC9O06EGo6g,Fox News,Janice Dean testifies before Congress on COVID nursing home deaths,Covid,2023-05-17T16:43:55Z,86593
834,D6q-_o_zOys,Fox News,Biden playing ‘Russian roulette with the American economy’: Sen. John Barrasso,Economy,2023-05-17T15:56:05Z,26014
835,amGd8UaVZNg,Fox News,Stephen Miller: This is the worst immigration crisis in world history,Immigration,2023-05-14T15:00:02Z,111217
836,jg0W6ta6Od0,Fox News,Biden officials accused of 'coordinating' illegal immigration flows with Mexico,Immigration,2023-05-11T11:00:37Z,119269
837,yvYad2wX5dM,Fox News,Gutfeld: Biden's immigration hypocrisy exposed,Immigration,2023-05-11T04:25:00Z,313808
838,7wrx4ijHLs8,Fox News,Biden is 'greenlighting' illegal immigration: Rep. Waltz,Immigration,2023-05-09T15:15:00Z,31800
839,iro27QzgJMg,Fox News,Tomi Lahren calls for 'millions of deportations' as Title 42 is set to end,Deportation,2023-05-09T13:00:35Z,82437
840,NbT5HmZzODQ,Fox News,Officials identify suspect in deadly Texas mall shooting,Shooting,2023-05-08T12:09:21Z,160968
841,49ESE-bSv64,Fox News,"At least 8 victims killed, 7 injured in Texas mall shooting",Shooting,2023-05-07T11:11:36Z,433267
842,fHrLjPuJC3Y,Fox News,Here's what we know so far in Texas mall shooting,Shooting,2023-05-07T03:15:03Z,264435
843,uMKr4pUcD6E,Fox News,Sen. Kennedy stumps Biden official with climate questions,Climate,2023-05-05T18:45:01Z,79956
844,t-Lep2vT1gs,Fox News,Sen. John Kennedy questions Department of Energy official on climate spending #shorts,Climate,2023-05-05T18:00:22Z,101621
845,BCZylYb20Cw,Fox News,"Atlanta Police: 1 dead, 4 hospitalized in midtown shooting",Shooting,2023-05-03T21:00:06Z,30257
846,SyIPF8JPQ2U,Fox News,Multiple injuries reported in Atlanta shooting,Shooting,2023-05-03T17:53:00Z,113981
847,Q1xTtD4cb_o,Fox News,This is how bad the economy could get | Will Cain Podcast,Economy,2023-05-03T10:00:19Z,142867
848,_Q_DE601jis,Fox News,"Illegal immigrant's alleged mass murder makes case for Biden impeachment, attorney claims",Immigration,2023-05-03T08:00:27Z,207620
849,V55-cUqq-Y0,Fox News,Ex-detective lauds capture of illegal immigrant suspected of five murders,Immigration,2023-05-03T06:00:15Z,17647
850,B_SMue7430Y,Fox News,Texas officials detail capture of illegal immigrant mass shooting suspect,Shooting,2023-05-03T02:19:39Z,46249
851,B_SMue7430Y,Fox News,Texas officials detail capture of illegal immigrant mass shooting suspect,Immigration,2023-05-03T02:19:39Z,46249
852,RF3CbCv0Ct8,Fox News,Illegal immigrant mass shooting suspect arrested,Shooting,2023-05-03T01:38:23Z,112919
853,RF3CbCv0Ct8,Fox News,Illegal immigrant mass shooting suspect arrested,Immigration,2023-05-03T01:38:23Z,112919
854,hqRn_goP-oA,Fox News,Widow speaks out after husband was killed by illegal immigrant,Immigration,2023-05-02T06:00:12Z,28445
855,1Ats8g3Stk8,Fox News,Is Hunter ‘too poor’ to pay child support?: Hannity,Poor,2023-05-02T03:36:53Z,96614
856,_3TGlFOewhA,Fox News,'BOILING POINT': This state just moved to ban natural gas stoves,Gas,2023-04-30T04:00:15Z,439375
857,d2CiAwe1DSc,Fox News,'The Five': Climate activists are hellbent on making your life miserable!,Climate,2023-04-28T23:20:00Z,218099
858,3-s4lpsskZY,Fox News,Kamala Harris delivers bizarre word salad on abortion rights #shorts,Abortion,2023-04-27T16:00:01Z,105470
859,CPD_Wlb0OG8,Fox News,Kamala Harris blasted for poor job performance: 'Whatever is below an F minus',Poor,2023-04-27T14:00:06Z,72414
860,NQUhmeDzmYI,Fox News,Taliban kills ISIS leader responsible for deadly Kabul airport bombing,ISIS,2023-04-26T10:06:26Z,27686
861,sL8EVwIiuq0,Fox News,South Dakota now home to lowest unemployment rate in American history,Unemployed,2023-04-26T03:07:01Z,39789
862,krCkBrsrPC8,Fox News,'The Five': Biden uses Tennessee lawmakers in gun grab push,Gun,2023-04-25T23:45:02Z,55062
863,nNEeTdlRcqc,Fox News,"Biden snubs shooting victims’ families by praising politicians, ignoring victims: Dana Loesch",Shooting,2023-04-25T02:00:27Z,63462
864,RlKiz-YxGe4,Fox News,Hilton: Biden is pandering to the far-left climate zealots,Climate,2023-04-24T10:00:17Z,19402
865,pTjH87Sf_Bk,Fox News,The Duffys on what GOP lawmakers are getting wrong on abortion | From The Kitchen Table,Abortion,2023-04-22T08:00:17Z,10652
866,jhE6drHHYdE,Fox News,Here's what the Supreme Court's abortion pill ruling means,Abortion,2023-04-21T23:45:09Z,145835
867,TNA8V6pwh38,Fox News,Liberal lawmaker under fire for saying immigrants clean homes #shorts,Immigration,2023-04-21T18:00:17Z,40153
868,0tDIUQ2mGuE,Fox News,Peter Doocy presses Karine Jean-Pierre on the economy #shorts,Economy,2023-04-20T17:00:01Z,231188
869,1h6QKqgWjxA,Fox News,'THE JIG IS UP': GOP accuses China of COVID origins cover-up,Covid,2023-04-20T06:00:02Z,18756
870,68MhtliIAvk,Fox News,Robert F. Kennedy Jr tells Tucker this is turning America into a system of socialism for the rich,Rich,2023-04-20T02:35:13Z,2399055
871,rUHGAipWkF4,Fox News,Bombshell report points to 2 COVID lab leaks in China,Covid,2023-04-19T14:35:16Z,57780
872,u3iFzHjQiaw,Fox News,COVID hearing witness warns stakes involved in finding origins ‘unimaginably grave’,Covid,2023-04-18T16:15:15Z,61400
873,4HTNstkBAco,Fox News,Officials give update after Alabama mass shooting,Shooting,2023-04-16T22:11:57Z,83661
874,Ofz8qsxj1jA,Fox News,Officials give press briefing after Alabama shooting leaves at least 4 dead,Shooting,2023-04-16T15:10:38Z,51780
875,KkYpKn_FaLg,Fox News,"Louisville shooting leaves at least 2 dead, 4 injured: Report",Shooting,2023-04-16T12:15:49Z,80604
876,sZAyD6Zurzk,Fox News,At least 20 people injured in Alabama shooting: Report,Shooting,2023-04-16T11:23:11Z,390103
877,yZYtHC59vPo,Fox News,Jimmy Failla: Woke mayors are making U-Haul rich | Fox Across America,Rich,2023-04-15T12:00:44Z,84787
878,OkiSgwUyoq8,Fox News,"Four people shot, one killed in Washington, DC shooting",Shooting,2023-04-11T18:19:11Z,119535
879,phw2gQ_00Jc,Fox News,"Louisville bank shooting suspect bought firearm legally, police say",Shooting,2023-04-11T16:53:12Z,92901
880,WN9mgkltz3M,Fox News,Louisville police say shooter livestreamed deadly bank shooting,Shooting,2023-04-11T10:12:47Z,130964
881,SMNDPXiP3fM,Fox News,Louisville police give a second update on deadly shooting,Shooting,2023-04-10T19:49:09Z,45025
882,ya7tQIHAqyw,Fox News,"White House comments on Louisville, Kentucky shooting",Shooting,2023-04-10T19:44:48Z,51070
883,4pjeJcVfwxI,Fox News,Kentucky Gov. Beshear lost 'close friend' in Louisville shooting,Shooting,2023-04-10T16:30:00Z,26311
884,XKtHCUbsWRk,Fox News,Louisville police give update on deadly shooting,Shooting,2023-04-10T15:23:34Z,67302
885,NX0LCFVgdVc,Fox News,"Police confirm five dead in Louisville, Kentucky shooting",Shooting,2023-04-10T14:27:18Z,151526
886,ZcuEoMwyF9E,Fox News,Former US AG sounds alarm on Dems attacking gun rights: ‘I am worried’,Gun,2023-04-09T21:00:21Z,149731
887,PWrQWC3QfRQ,Fox News,Hollywood film glorifies eco-terrorism as climate solution,Climate,2023-04-09T01:00:14Z,56485
888,OTczK5b4bpo,Fox News,Sheriff to Jesse Watters: Gun laws don't prevent shootings,Gun,2023-04-08T04:41:35Z,56710
889,zsDms8mc68k,Fox News,Tucker Carlson: Transgenderism is America's fastest-growing religion,Religion,2023-04-08T01:30:31Z,1419291
890,1t9Cr88sAbk,Fox News,Tucker Carlson: This will lead to poverty all over the US,Poverty,2023-04-06T01:10:21Z,3768037
891,iMHOuY8v38A,Fox News,Attorney tells Tucker he was forcibly given psych eval for questioning COVID policies,Covid,2023-04-02T21:30:03Z,642657
892,eP41j1yR44w,Fox News,Taking away guns is a ‘horrible’ idea: Ryan Cleckner,Gun,2023-04-02T05:00:17Z,58618
893,PyYiR7hEgk8,Fox News,"‘UNHINGED’: Pro-life event swarmed by protestors, seen ‘attacking’ students",Pro-life,2023-04-01T14:30:07Z,532739
894,CDAeO3r8wBE,Fox News,White House claims Biden's immigration policies are working,Immigration,2023-03-30T19:37:08Z,30407
895,Ta5yazbVgJU,Fox News,Gun control protesters rally in Tennessee Capitol building,Gun,2023-03-30T17:41:52Z,61785
896,JL2nzZxRll4,Fox News,GOP lawmaker sparks outrage with response to Nashville shooting: 'We need to repent',Shooting,2023-03-30T16:30:03Z,91073
897,gYKMORPqTDk,Fox News,The 'disgusting national ritual' of politicizing school shootings | Guy Benson Show,Shooting,2023-03-30T09:00:20Z,12655
898,BU6NsUZ_IT8,Fox News,Dr. Lisa Strohman: Nashville school shooting is a mental health issue | Brian Kilmeade Show,Shooting,2023-03-30T07:30:02Z,13618
899,pzUnROkizJA,Fox News,Gutfeld: The media is to blame for copycat shootings,Shooting,2023-03-30T03:35:00Z,288742
900,RT0uVAkWwwI,Fox News,Hannity: The left's repulsive response to Nashville school shooting,Shooting,2023-03-30T02:56:58Z,568106
901,gJ1ewe5z4wo,Fox News,Biden eviscerated for ice cream joke after shooting,Shooting,2023-03-29T16:45:01Z,803239
902,V7XPxjG_EFM,Fox News,Nashville police officers who stopped school shooting honored as heroes,Shooting,2023-03-29T10:30:16Z,66531
903,hTEYEY1z0xQ,Fox News,Police release bodycam footage from Nashville school shooting,Shooting,2023-03-28T14:59:19Z,811352
904,GR4UtTbuw7k,Fox News,Christie slams Biden over Nashville shooting handling,Shooting,2023-03-28T07:30:04Z,119701
905,S0Cr5nTy2_0,Fox News,Live: Nashville police give the latest update on deadly school shooting,Shooting,2023-03-27T21:33:44Z,46751
906,sfW8CrGlSgA,Fox News,Nashville police give the latest update on deadly school shooting,Shooting,2023-03-27T19:09:28Z,49734
907,eTtyrQ5MLTA,Fox News,Biden delivers remarks on Nashville school shooting,Shooting,2023-03-27T19:09:07Z,178284
908,jhrdviNkgxY,Fox News,'We need to do something': Karine Jean-Pierre addresses Nashville school shooting,Shooting,2023-03-27T18:51:01Z,30857
909,T6LlcWXzmGA,Fox News,6 killed in Nashville school shooting; officials brief reporters,Shooting,2023-03-27T17:32:41Z,123779
910,RrExXnDFbno,Fox News,Three children killed in Nashville school shooting,Shooting,2023-03-27T17:02:30Z,233205
911,G9Hn1ksqfYA,Fox News,"Nashville elementary school shooting reported to be 'mass casualty' event, shooter dead",Shooting,2023-03-27T16:40:52Z,195310
912,LLKaH-mNXDc,Fox News,Kirby: Biden believes strongly we need to find the roots and origins of COVID,Covid,2023-03-24T05:15:00Z,42556
913,yOL1LKf1MqU,Fox News,Fox reporter reunited with son live on air after school shooting,Shooting,2023-03-23T00:15:02Z,148743
914,RRNQfQ9NXuI,Fox News,"What's the biggest threat — China, Russia or climate change? | Americans Weigh In",Climate,2023-03-22T08:00:10Z,42963
915,Op14Hq9mrTc,Fox News,Greg Gutfeld destroys the left’s gun control argument #shorts,Gun,2023-03-16T17:00:13Z,61240
916,u3BnfMqcQHQ,Fox News,‘The Five’: Biden is coming for your guns,Gun,2023-03-15T22:45:02Z,155965
917,cUkwLZNhyso,Fox News,Biden's latest gun control order torched by Republicans,Gun,2023-03-15T12:45:02Z,92141
918,8iTL5aPUyiE,Fox News,President Biden discusses efforts to reduce gun violence,Gun,2023-03-14T21:10:50Z,26686
919,UmJfr21C478,Fox News,President of Mexico threatens sabotage campaign against Republicans | Guy Benson Show,Mexico,2023-03-14T10:30:18Z,179864
920,VsLzi7c6wbI,Fox News,‘The Big Sunday Show’: Fauci lashes out at GOP over COVID origins probe,Covid,2023-03-13T02:15:01Z,477797
921,ZVcxXEzVluQ,Fox News,GOP rep says Biden may have tried to cut corners on COVID vax approval,Covid,2023-03-12T20:30:05Z,57298
922,unxSwWtf7XM,Fox News,"Lawrence Jones offers a live report on the killings of Americans in Matamoros, Mexico",Mexico,2023-03-11T18:00:20Z,46709
923,J9aUaYuPZJk,Fox News,Jane Fonda walks back extreme comment on 'The View',Extremism,2023-03-11T16:00:09Z,413739
924,y0TeZ9JOMmM,Fox News,Will Cain: This is why Fauci went to such lengths to cover up COVID origins,Covid,2023-03-09T20:15:01Z,466380
925,qUMViEq9YRc,Fox News,"Fauci 'squashed' COVID origin debate, says former CDC chief",Covid,2023-03-09T15:45:04Z,43153
926,21TEkNpy3Cc,Fox News,"As COVID Origins Probe Escalates, So Do Tensions With China",Covid,2023-03-09T09:00:01Z,16165
927,TF-U34MAFaM,Fox News,Russell Brand tells Tucker about the harmful effects of COVID lockdowns,Covid,2023-03-09T03:40:06Z,601145
928,BXQDHggRxp4,Fox News,Ex-CDC director speaks out on COVID lab leak theory,Covid,2023-03-08T22:10:00Z,87672
929,h9px9RCkZPA,Fox News,Karine Jean-Pierre responds to Federal Reserve's comments on inflation,Inflation,2023-03-08T18:31:09Z,20267
930,JPANfMIsUHo,Fox News,Karine Jean-Pierre addresses the attack on four Americans in Mexico,Mexico,2023-03-07T19:41:45Z,24484
931,OAIdOxq4O9Y,Fox News,"Two Americans kidnapped in Mexico reportedly found alive, two found dead",Mexico,2023-03-07T18:45:00Z,63949
932,NBd809w2pWE,Fox News,White House makes statement on kidnapped Americans in Mexico,Mexico,2023-03-06T19:50:32Z,34911
933,QIVNESUZgMc,Fox News,DeSantis' immigration plan would invalidate Newsom's IDs for illegal immigrants | Digital Original,Immigration,2023-03-06T14:15:01Z,72630
934,lb8-dGIb1ww,Fox News,Climate religion is 'shackling' America: Ramaswamy,Religion,2023-03-06T01:30:13Z,33128
935,lb8-dGIb1ww,Fox News,Climate religion is 'shackling' America: Ramaswamy,Climate,2023-03-06T01:30:13Z,33128
936,lkNoOMkiTno,Fox News,Biden admin makes 'stunning' admission in leaked climate memo,Climate,2023-03-05T19:00:30Z,539038
937,6thWA_Wktq4,Fox News,This is what keeps me up at night: Economy expert,Economy,2023-03-04T21:00:03Z,38811
938,H8IxnMTDxDg,Fox News,White House to Fox News: 'Still no consensus' on COVID origins,Covid,2023-03-02T21:24:14Z,27243
939,Rp_-T-5KBF0,Fox News,Jesse Watters: Buying mace in Manhattan is almost as hard as getting a gun #shorts,Gun,2023-03-01T17:00:32Z,96491
940,NpAAHGue1ls,Fox News,Proposed Minnesota bill would require students receive a ‘climate justice education’,Climate,2023-03-01T11:00:28Z,36306
941,MgMoy9NIsjc,Fox News,Gutfeld: This COVID lab leak story is such a big deal,Covid,2023-02-28T05:00:10Z,521441
942,d2FR4QhyPUU,Fox News,Fox News' Jacqui Heinrich confronts Karine Jean-Pierre on new COVID lab leak report,Covid,2023-02-27T20:53:06Z,58205
943,op4TqXXNcUI,Fox News,Washington Post walks back criticism of COVID origin theory,Covid,2023-02-27T13:30:17Z,71794
944,PG4ym_t_1Gc,Fox News,Florida shooting suspect who killed three in Orlando had long criminal history,Shooting,2023-02-24T18:00:12Z,24705
945,Drtte-G2kPU,Fox News,Vince Everett Ellison: An insane asylum has taken over the Democratic party,Asylum,2023-02-24T06:30:03Z,287606
946,vh-s_1fgcug,Fox News,Journalist among 3 people killed in Orlando shootings,Shooting,2023-02-23T14:00:29Z,59062
947,7oPKic3OYoE,Fox News,Pandemic 'learning Loss' will cost our kids and the economy | Fox News Rundown,Economy,2023-02-23T08:00:03Z,5586
948,_6rvnVN2un4,Fox News,Biden admin unveils migrant policy to restrict asylum seekers,Asylum,2023-02-22T16:30:04Z,58317
949,sroVnFZoNxw,Fox News,Alec Baldwin secures major win after DA drops firearm charge,Firearm,2023-02-20T19:19:49Z,85422
950,JD88SAI4Olk,Fox News,"Steve: America is becoming extremely anti-immigrant, and it’s because of Biden’s open border",Extremism,2023-02-20T04:15:00Z,57441
951,uAKm2niGx9M,Fox News,"White House claims US economy at pre-pandemic levels, Biden sees no weakness",Economy,2023-02-17T20:05:46Z,42511
952,bRniJsOHtB0,Fox News,How climate alarmism is making people childless by choice | Digital Original,Climate,2023-02-17T08:00:28Z,13220
953,AWiKjyJ0pUk,Fox News,"Biden breaks silence on shooting down aerial objects, reveals intel assessment",Shooting,2023-02-16T20:13:57Z,48179
954,sqRUMhZnJfs,Fox News,Michigan officials hold press briefing on MSU shooting,Shooting,2023-02-16T16:20:23Z,18065
955,58umdzPnPTc,Fox News,Bret Baier on WH explanation over UFO shoot downs: 'It just doesn't add up' | Guy Benson Show,Shooting,2023-02-16T08:45:00Z,26983
956,JmGZm9z9RKU,Fox News,COVID Fraud: Where did the billions of dollars go? | Fox News Rundown,Covid,2023-02-16T08:00:06Z,17856
957,x2F_5apEHzQ,Fox News,Crisis in Kensington: Documenting America’s largest open-air drug market | Digital Original,Market,2023-02-15T08:00:24Z,26051
958,PoIZqi7yZTA,Fox News,'Jarring' details revealed about college mass shooting suspect,Shooting,2023-02-14T14:15:03Z,166187
959,d-OwXsDGbIQ,Fox News,"Biden's State of the Union touts strong economy, but are Americans better off?",Economy,2023-02-13T07:00:08Z,51119
960,SOYStxYcWjo,Fox News,US shoots down third 'object' after initial Chinese spy craft,Shooting,2023-02-12T22:30:10Z,1432310
961,NKBfz6jI9E8,Fox News,"Drug cartels are profiting from Biden's border failure, immigration policies: Davidson",Immigration,2023-02-11T17:00:15Z,31890
962,Q51n7gNn3Fc,Fox News,"Biden's State of the Union lies, Spring Break danger in Mexico | From The Kitchen Table",Mexico,2023-02-11T14:00:12Z,62299
963,yyEtahdAW7I,Fox News,Tony Dungy: I'm pro-life and I should be able to say that | Brian Kilmeade Show,Pro-life,2023-02-11T13:00:43Z,76559
964,j9QaUtpsuoA,Fox News,Tucker: The climate cult has grown stronger,Climate,2023-02-11T02:00:11Z,688827
965,8URgfBZKHCE,Fox News,US shoots down 2nd object over Alaska,Shooting,2023-02-10T20:22:23Z,77156
966,bqlJPlZvXYI,Fox News,Alaska senator warns White House on spy flights: Next time 'we'll shoot it down',Shooting,2023-02-10T16:00:31Z,292133
967,WC85myWBAe4,Fox News,Jared Bernstein: 'We are outperforming where people thought the economy would be',Economy,2023-02-08T09:00:16Z,22838
968,5nY_QzCS_gw,Fox News,'The Five': Biden won't shoot down China's giant spy balloon,Shooting,2023-02-03T22:30:01Z,798359
969,RR7kmtvSXHU,Fox News,Students kicked out of Air & Space Museum for pro-life hats,Pro-life,2023-02-03T08:00:19Z,65821
970,lysMTWllsA8,Fox News,Biden won't shoot down Chinese spy balloon over US,Shooting,2023-02-03T06:15:03Z,675392
971,3y6UpzU_Y_k,Fox News,Gutfeld: Even illegal immigrants are against illegal immigration,Immigration,2023-02-02T05:00:03Z,552092
972,9FGayd5XErM,Fox News,Biden torched for claiming climate change is bigger threat than nuclear war,Climate,2023-02-01T18:15:00Z,53945
973,5Uq4taIWVZk,Fox News,Pro-life activist Mark Houck on shocking details of Planned Parenthood confrontation after acquittal,Pro-life,2023-01-31T06:30:02Z,53659
974,ayrsO87oiVY,Fox News,"Terror watchlist, sex offender arrests surge at the border. Is America worried? | Americans Weigh In",Terrorism,2023-01-31T05:00:03Z,20092
975,3ZH-hk4NiEA,Fox News,Greg Abbott: Biden's new border policy will attract more illegal immigrants,Immigration,2023-01-27T10:15:00Z,25183
976,Bk0W0RXl--k,Fox News,Karine Jean-Pierre addresses California shootings at White House briefing,Shooting,2023-01-24T19:54:17Z,44971
977,VcAg1zdjyvY,Fox News,Antifa rioters revealed as rich kids from out of town,Rich,2023-01-24T19:45:01Z,127656
978,UkaF3yAi5gI,Fox News,Dem governor caught using gas stove while pushing for ban: 'Is anybody surprised?',Gas,2023-01-23T17:45:02Z,468795
979,t2WJk9NMxbc,Fox News,Former WH COVID coordinator expected to replace Biden's chief of staff,Covid,2023-01-22T19:00:16Z,264912
980,ak6x4kd3cvs,Fox News,California mass shooting leaves at least 10 victims dead,Shooting,2023-01-22T13:00:01Z,411264
981,OawJSUVIOVQ,Fox News,Biden admin did not reach out to us over attacks on our pro-life facility: Kristi Brown,Pro-life,2023-01-22T09:00:18Z,53705
982,z41DZGk1560,Fox News,Newly discovered Fauci emails say COVID looked potentially 'engineered',Covid,2023-01-20T21:15:02Z,1222106
983,EY-_2hyJAEA,Fox News,Never trust an angry rich guy: Jesse Watters #shorts,Rich,2023-01-20T02:15:00Z,78859
984,KNj5UJyl5DQ,Fox News,Biden’s strange comment about ‘taking on government’ with guns #biden #shorts #shortsfeed,Gun,2023-01-20T00:00:12Z,65400
985,GKstmoEvXPc,Fox News,Alec Baldwin charged with involuntary manslaughter over 'Rust' shooting,Shooting,2023-01-19T16:13:35Z,307610
986,s_C8hUGHfI0,Fox News,Tucker: America's favorite unemployed media critic,Unemployed,2023-01-19T15:00:29Z,31175
987,d3OaBVFCe80,Fox News,Tucker roasts ‘unemployed media critic’ Brian Stelter #shorts,Unemployed,2023-01-19T11:00:26Z,214548
988,dTIr0AyeXP0,Fox News,Abortion survivor responds to Dems' NO vote on Born-Alive bill | Digital Originals,Abortion,2023-01-19T09:30:06Z,17512
989,UgaWhKFKAq4,Fox News,Why 'the poor' may not care so much about saving the planet #shorts,Poor,2023-01-18T15:00:18Z,78250
990,Zp4x9RVOPzY,Fox News,'The Five' ridicules AOC's 'wine night' gas stove rant,Gas,2023-01-16T12:00:22Z,704419
991,cw9NtjV9VlM,Fox News,AOC explains why she uses a gas stove: ‘I rent’ #shorts #aoc,Gas,2023-01-15T01:30:13Z,255480
992,m0XzrFrBxBQ,Fox News,AOC hits back after mockery over gas stove ban,Gas,2023-01-13T19:30:04Z,467795
993,PDSsVjzPxAY,Fox News,Sen. Kennedy roasts idea of proposed gas stove ban #shorts,Gas,2023-01-12T15:00:12Z,30851
994,niOYKEA3Syc,Fox News,AOC torched for 'ridiculous' gas stove claims,Gas,2023-01-12T14:15:02Z,259038
995,MBo6zEwduyM,Fox News,Tucker Carlson: People are getting very rich from this,Rich,2023-01-12T12:15:02Z,388611
996,Z3gdiukf1ms,Fox News,Will this 'good guy with a gun' face consequences? | Will Cain Podcast,Gun,2023-01-12T07:30:04Z,16457
997,Q8kcbHXDREY,Fox News,Chef speaks out over proposed ban of gas stoves: ‘I’m livid’,Gas,2023-01-11T10:00:12Z,63252
998,KeXKe904v80,Fox News,Restaurant owner speaks out on potential gas stove ban,Gas,2023-01-11T08:30:04Z,204066
999,-5OQA6YP5yM,Fox News,San Francisco activist exposes bus stops 'hijacked' as 'open-air drug markets' | Digital Originals,Market,2023-01-09T06:00:00Z,96895
1000,aPR8dOznTZs,Fox News,New terror groups form due to Afghanistan withdrawal,Terrorism,2023-01-08T03:00:00Z,81270
1001,vxmfjkrqjR4,Fox News,"Watters: Sinaloa, Mexico, has become a battlefield",Mexico,2023-01-07T01:03:56Z,502336
1002,ZChtw32DXfk,Fox News,Cardi B unleashes on inflation under Biden,Inflation,2023-01-06T21:15:01Z,59310
1003,M5QvtCDnwN8,Fox News,Arrest of El Chapo's son sparks riots in Mexico,Mexico,2023-01-06T13:45:01Z,101952
1004,ByVI0DGRpMU,Fox News,"VP Harris delivers remarks on the economy, infrastructure",Economy,2023-01-04T19:07:49Z,18907
1005,C-xvCeGFgOk,Fox News,'The Five': Climate nuts have finally gone too far,Climate,2023-01-04T00:15:00Z,210901
1006,3KIHzKBFPWc,Fox News,What lies ahead for the economy in 2023?,Economy,2022-12-31T22:00:01Z,61186
1007,gvQUIXInTzU,Fox News,Ben Carson addresses Dr. Fauci's COVID decisions,Covid,2022-12-31T10:30:08Z,211922
1008,ZzGYEGnae1U,Fox News,American people need to appreciate freedom: Cuban immigrant Yoel Diaz,Immigration,2022-12-31T05:45:01Z,29164
1009,GCDZeq38w5Q,Fox News,Biden ripped for 'hypocrisy' over China COVID policy,Covid,2022-12-29T20:00:04Z,57873
1010,5KLcFZFcOcU,Fox News,Biden admin requiring COVID tests for all travelers from China,Covid,2022-12-29T13:15:00Z,21389
1011,xvseGssi2SI,Fox News,Kirk Cameron touts DeSantis investigating drag event allegedly marketed to children,Market,2022-12-29T02:13:33Z,800471
1012,fo-ThZb0JAE,Fox News,Biden is not following immigration law on purpose: Rep. Byron Donalds,Immigration,2022-12-28T04:13:02Z,55393
1013,LdCPIk05MXc,Fox News,'Twitter Files' reveal both Trump and Biden admins tried to suppress COVID views,Covid,2022-12-27T13:30:04Z,66979
1014,uilVdwPg1Lc,Fox News,Sandra Smith explores the rich history of West Point,Rich,2022-12-25T03:30:11Z,19790
1015,Ykh5ty18i10,Fox News,The lunatics are running the asylum in California: Harmeet Dhillon,Asylum,2022-12-24T20:00:07Z,222860
1016,hfVhF6OOKQ4,Fox News,Common Ground: Confronting America's immigration crisis | The Bret Baier Podcast,Immigration,2022-12-24T11:00:32Z,23406
1017,2Td5GHNQIgY,Fox News,Woman arrested near British abortion center for praying speaks out,Abortion,2022-12-24T04:00:00Z,380162
1018,OkSE5cJQxX8,Fox News,Illegal immigration is a humanitarian crisis: Sen. Marsha Blackburn,Immigration,2022-12-21T09:00:10Z,16346
1019,_evqapQpxUQ,Fox News,CBS slammed for bizarre claim about climate change,Climate,2022-12-20T21:15:00Z,368087
1020,TTEnx1MEmxA,Fox News,Sen. Ron Johnson on mass illegal immigration: 'Completely out of control',Immigration,2022-12-20T10:30:08Z,23469
1021,YVPffMESC6s,Fox News,Biden admin to make US citizenship test easier,Citizenship,2022-12-18T01:00:08Z,35390
1022,-k4oz1_yw1U,Fox News,The Biden economy is nothing like the Reagan economy,Economy,2022-12-17T06:45:00Z,22472
1023,V_p6fDy42XI,Fox News,Tucker laughs at Mayor Pete's correction: 'Same amount of carbon!',Carbon,2022-12-16T04:00:07Z,45165
1024,1ZNj31QbM-c,Fox News,Rep. Nancy Mace confronts activist over extreme rhetoric #shorts,Extremism,2022-12-16T01:00:00Z,145624
1025,rz8z9wBWZkk,Fox News,GOP report alleges COVID could be tied to China's bioweapons program,Covid,2022-12-15T13:15:02Z,110463
1026,LQmJvUHZZA4,Fox News,Jesse Watters: Gavin Newsom had a little photo shoot at the border #shorts #shortsvideo #shortsfeed,Shooting,2022-12-14T16:00:11Z,51340
1027,uEzxulMJcig,Fox News,Idaho murder mystery: Gas station footage reveals suspicious car,Gas,2022-12-14T14:00:26Z,76856
1028,mKN7r_-TUxY,Fox News,Tucker roasts lawmaker for saying child has nightmares about climate change #shorts,Climate,2022-12-14T02:00:15Z,35658
1029,Jdk21AFAkPM,Fox News,AOC's climate documentary bombs in theaters,Climate,2022-12-13T21:15:00Z,360589
1030,-NjNvb6CMRY,Fox News,Forbes: This is the bottom line for the Biden economy,Economy,2022-12-13T19:00:00Z,60627
