,id,channel_name,title,keyword,published_at,VideoViews
0,cF24uzD9EMI,Ben Shapiro,Another Shooting at a Church in Houston,Shooting,2024-02-13T22:30:04Z,162443
1,VOkkGuOqQVY,Ben Shapiro,"Illegal Immigrants Pummel Cops, Walk Free",Immigration,2024-02-01T18:00:11Z,190787
2,p0lr2GE_tYc,Ben Shapiro,Pro-Life Protesters Arrested,Pro-life,2024-01-31T22:30:07Z,67120
3,re1nbhsUCE4,Ben Shapiro,"The ""Magic Word"" for Immigrants",Immigration,2024-01-31T20:00:21Z,107104
4,m0An8qb5jSs,Ben Shapiro,Biden's Immigration Policy,Immigration,2024-01-31T00:30:32Z,259543
5,sAKmcEMSYLo,Ben Shapiro,How to Get Rich,Rich,2024-01-28T20:00:25Z,514254
6,wDcTRo0DvzU,Ben Shapiro,Climate Change vs. Nuclear Warfare,Climate,2023-12-31T20:00:21Z,527527
7,cnh9dYmAPfY,Ben Shapiro,Biden’s Economy,Economy,2023-12-28T02:00:12Z,1341988
8,k4hga3Ahh08,Ben Shapiro,"Poor, Poor Hunter Biden",Poor,2023-12-14T18:00:09Z,148554
9,aWBLOqqAUTM,Ben Shapiro,Hamas Supporters Should Be Deported | @YAFTV,Deportation,2023-11-11T20:00:00Z,157939
10,rkDsCwbcKzo,Ben Shapiro,"Caravan Of Illegal Immigrants CHANT ""Biden!""",Immigration,2023-11-11T01:00:27Z,48523
11,Q35mm2J-K6I,Ben Shapiro,Ben Shuts Down Pro Abortion Student,Abortion,2023-11-04T19:10:55Z,669036
12,wxPtIua6neE,Ben Shapiro,This Is Why Jews Need Guns,Gun,2023-10-27T23:00:26Z,160142
13,E8EQzIrjigg,Ben Shapiro,A Shooting in Maine,Shooting,2023-10-26T21:30:01Z,311304
14,sVLIm8LrAgg,Ben Shapiro,Biden’s Car Crash Economy,Economy,2023-09-27T17:00:11Z,135182
15,mHKrE8nUXu8,Ben Shapiro,There's an Actual COLONY for Illegal Immigrants,Immigration,2023-09-20T23:00:21Z,101206
16,D4o2b4owypQ,Ben Shapiro,Zelenskyy Speaks Out About...Climate Change?,Climate,2023-09-20T21:00:06Z,41296
17,cevBEXhytbs,Ben Shapiro,New Mexico Governor Suspends People’s Right to Carry Guns,Gun,2023-09-11T21:00:13Z,101035
18,cevBEXhytbs,Ben Shapiro,New Mexico Governor Suspends People’s Right to Carry Guns,Mexico,2023-09-11T21:00:13Z,101035
19,1jOPgFBqN8g,Ben Shapiro,Biden Participates in COVID Theater,Covid,2023-09-09T21:00:02Z,94369
20,BGaHSP0GYc8,Ben Shapiro,Eric Adams Flip-Flops on Illegal Immigration,Immigration,2023-09-09T01:00:04Z,286340
21,ZlbgNVetuA8,Ben Shapiro,Climate Protestors Get BOOED At US Open,Climate,2023-09-08T23:00:35Z,153416
22,9YKacT3t5YY,Ben Shapiro,Jill Biden Has COVID,Covid,2023-09-06T21:30:01Z,148046
23,mBahW_UM2r8,Ben Shapiro,Democrats Blame Republicans For Latest White Supremacist Shooting Spree,Shooting,2023-08-29T17:00:09Z,164505
24,qDPk-EgLnmc,Ben Shapiro,A Comedian on Abortion,Abortion,2023-08-20T23:00:30Z,2218230
25,G9z9RnAgShg,Ben Shapiro,First Anniversary of Inflation Reduction Act,Inflation,2023-08-20T15:00:08Z,120281
26,jCntwYIHy5k,Ben Shapiro,The Chinese Economy Is About To Drag Us Down,Economy,2023-08-18T21:00:21Z,188397
27,9t9usd-oIUk,Ben Shapiro,Vegas and the Stock Market,Market,2023-08-17T01:00:06Z,410054
28,hQblL2zpuGE,Ben Shapiro,The Economy Isn't As Rosy As They Think,Economy,2023-08-10T21:30:05Z,127266
29,TKz4C5vR3UA,Ben Shapiro,The Economy Is Spiraling The Drain,Economy,2023-08-09T17:00:10Z,188670
30,dFugydLI2Pk,Ben Shapiro,Inflation Is Down 👀,Inflation,2023-07-13T21:27:59Z,277114
31,lit6n-nEKjI,Ben Shapiro,Pro-Life Comedian?,Pro-life,2023-06-20T00:15:01Z,13563889
32,0MokC95_ijI,Ben Shapiro,Musk and Rogan vs. The Biggest Covid Scientist,Covid,2023-06-19T17:00:09Z,291439
33,BYIe2fLLEYE,Ben Shapiro,Inflation Must Be Bad,Inflation,2023-06-05T23:00:04Z,917987
34,lOjGSHvwmEM,Ben Shapiro,"Shooting in Allen, TX",Shooting,2023-05-08T22:05:26Z,546913
35,JffURyCMJCk,Ben Shapiro,Democrats Answer to the Shooting,Shooting,2023-04-10T21:00:15Z,1188742
36,GmeYUrGiI7Q,Ben Shapiro,This Is the Worst Take on the Nashville Shooting,Shooting,2023-03-29T23:00:05Z,263238
37,uJa0Tw9H_9g,Ben Shapiro,Worst Take On Nashville Shooting,Shooting,2023-03-29T21:00:21Z,393932
38,1uFvrqKmMEQ,Ben Shapiro,Nashville Covenant School Shooting,Shooting,2023-03-28T22:12:19Z,939378
39,R8mUAySVaRA,Ben Shapiro,Is The Economy About To Meltdown?,Economy,2023-03-13T17:00:07Z,414230
40,FmqVgE4MKCk,Ben Shapiro,Katy Perry WEEPS Over Gun Control on 'American Idol',Gun,2023-02-28T22:30:02Z,195505
41,d9WK5FfTiaE,Ben Shapiro,"Biden’s America: Massive Inflation, Chinese Spy Balloons, And Exploding Trains | Ep. 1669",Inflation,2023-02-15T18:00:07Z,141303
42,1ETYfFg31UM,Ben Shapiro,The Priest Class of the New World Religion,Religion,2023-01-19T23:40:24Z,61449
43,Qo0ionyh4nE,Ben Shapiro,Biden Heads To The Border To Lie About Stopping Illegal Immigration | Ep. 1641,Immigration,2023-01-06T18:00:09Z,128469
44,JhurG8dcZoA,Ben Shapiro,You Know Inflation Is Bad When Cardi B Gets Involved,Inflation,2023-01-05T23:06:17Z,159656
45,aYBy8bq_Y-w,Ben Shapiro,Why China's Covid Tyranny Should Scare Us All | Ep. 1619,Covid,2022-11-29T18:00:10Z,188974
46,zCGUkOHN4QU,Ben Shapiro,5 Killed and 25 Injured in Tragic CO Springs Shooting,Shooting,2022-11-21T22:15:02Z,156599
47,PXpEOZaRQ5s,Ben Shapiro,Ben Shapiro REACTS to INSANE Woke Religion TikToks | Part 2,Religion,2022-10-29T16:00:19Z,1168785
48,VbWdz9L8PQc,Ben Shapiro,This Is Clearly Not About Climate Change.,Climate,2022-10-26T20:00:08Z,334849
49,DYPlXrqT5-E,Ben Shapiro,"They Lied About Covid, And Young People Paid The Price | Ep. 1596",Covid,2022-10-25T17:00:09Z,317097
50,uDRhXIXgHxQ,Ben Shapiro,Ben Shapiro REACTS to INSANE Woke Religion TikToks | Part 1,Religion,2022-10-08T17:00:36Z,2647976
51,3o-ridXTt8w,Ben Shapiro,This Is What the Left Doesn’t Understand About “Gun Crime”,Gun,2022-09-28T00:00:03Z,172476
52,cxrGfJfwOuA,Ben Shapiro,"To Push Abortion, The Left Promotes A Fetal Heartbeat Hoax | Ep. 1581",Abortion,2022-09-23T17:00:09Z,172084
53,j9sicDl-X8Y,Ben Shapiro,Responding to Chrissy Teigen's Viral Abortion Controversy,Abortion,2022-09-21T23:00:16Z,234327
54,PpEUXwFdtAU,Ben Shapiro,Lila Rose Breaks Down Her Viral Dr. Phil Abortion Debate,Abortion,2022-09-15T23:30:03Z,109682
55,6Te-0iSaccg,Ben Shapiro,DeSantis Sends Illegal Immigrants to Obama’s Neighborhood,Immigration,2022-09-15T22:30:00Z,238907
56,cB_2J8tePvg,Ben Shapiro,Leftists Love Illegal Immigrants...Until They Go To Martha's Vineyard | Ep. 1575,Immigration,2022-09-15T17:00:11Z,266694
57,Nz6yVnYiAgI,Ben Shapiro,Ben Reacts to Abortion Debate Between Dr. Phil and Lila Rose,Abortion,2022-09-14T22:30:02Z,457936
58,HoYEzVqJ4Qs,Ben Shapiro,Joe Biden Celebrates Reducing Inflation…As Inflation Continues To Explode | Ep. 1574,Inflation,2022-09-14T17:00:11Z,222332
59,0q0A52W-miM,Ben Shapiro,Inflation Is Now Cars’ Fault?!,Inflation,2022-09-06T21:30:00Z,135849
60,JbEAYSEBQYA,Ben Shapiro,The Inflation Reduction Act That Doesn’t Reduce Inflation | Ep. 1558,Inflation,2022-08-18T17:00:09Z,170475
61,vW5KxrTEchQ,Ben Shapiro,"Yes, Illegal Immigration Is Spiking Thanks To Joe Biden | Ep. 1554",Immigration,2022-08-11T17:00:10Z,138357
62,kNDvepKg66M,Ben Shapiro,"Yes, Democrats Are To Blame For Inflation | Ep. 1551",Inflation,2022-08-08T17:00:09Z,208903
63,2UHZSCu8D-8,Ben Shapiro,The Difference Between Jewish Ethnicity and Religion,Religion,2022-08-07T21:00:02Z,337440
64,4_PVQskjOdo,Ben Shapiro,Ben Shapiro Answers Viewer Questions About Religion,Religion,2022-08-06T20:30:00Z,160351
65,uc2MURmsKwg,Ben Shapiro,Should ANY Guns Be Banned?,Gun,2022-08-04T19:00:32Z,226254
66,pppRZ8whlCQ,Ben Shapiro,The Democrats’ Abortion Celebration | Ep. 1549,Abortion,2022-08-04T17:00:09Z,162593
67,IuuYl_zXjUw,Ben Shapiro,Joe Biden Is Made Of Covid | Ep. 1546,Covid,2022-08-01T17:00:09Z,224484
68,PUNjDQttyzU,Ben Shapiro,Ben Shapiro SHREDS Bill Nye and Other Abortion Activists,Abortion,2022-07-30T17:15:00Z,542857
69,_1If5eD1TOA,Ben Shapiro,Whatever Argument You Make for Abortion Can Also Be Used on Adult Humans,Abortion,2022-07-24T21:00:12Z,590532
70,8aVSOXfBOhE,Ben Shapiro,One of the Bravest Voices in the Music Industry | John Rich,Rich,2022-07-22T23:41:38Z,111895
71,1c2jdkCsOok,Ben Shapiro,Biden Has Covid | Ep. 1540,Covid,2022-07-22T17:00:11Z,213896
72,LHnOZHbvigE,Ben Shapiro,"The Real National Emergency Isn’t Climate Change, It’s Weakness | Ep. 1538",Climate,2022-07-20T17:00:09Z,208556
73,LJGrVvpFJZk,Ben Shapiro,The Most Articulate Response to the Overturning of Roe v Wade,Roe,2022-07-14T19:00:06Z,158963
74,8ort-6dUUzk,Ben Shapiro,Joe Biden’s Economy Is In Flames | Ep. 1534,Economy,2022-07-14T17:00:08Z,239863
75,LmUipuPcPEY,Ben Shapiro,This Roe v. Wade Argument Makes NO Sense,Roe,2022-07-07T19:00:16Z,276672
76,t6_VwWXBWo0,Ben Shapiro,Everything You Need to Know About the Highland Park Shooting,Shooting,2022-07-05T23:00:20Z,272840
77,bh02aXhDAIU,Ben Shapiro,Ben Shapiro Exposes the DISGUSTING REALITY Of Abortion,Abortion,2022-07-03T17:00:30Z,380374
78,WNx7s58q5cY,Ben Shapiro,Former Abortionist Reacts To Roe v. Wade Ruling,Roe,2022-06-29T01:00:05Z,201575
79,7xRCoQIDgIE,Ben Shapiro,What Is the Pro-life Stance on Preserving the Life of the Mother?,Pro-life,2022-06-27T19:15:00Z,132357
80,-Z9E3kgx9lE,Ben Shapiro,"Roe Is Gone, And The Left Is Melting Down | Ep. 1523",Roe,2022-06-27T17:00:09Z,332161
81,S0XQW2B_kBo,Ben Shapiro,When Life Begins Is Science – Not Religion | With Lila Rose,Religion,2022-06-26T19:00:11Z,243494
82,mee1F4h_DTA,Ben Shapiro,Abortion Is Evil – No Matter What,Abortion,2022-06-25T21:00:18Z,239334
83,4HXBF6HJVmY,Ben Shapiro,Ben Shapiro Breaks Down The Media's Gun Control LIES,Gun,2022-06-25T17:00:02Z,149365
84,dwQ3VoLI2wM,Ben Shapiro,"Goodbye, Roe v. Wade | Ep. 1522",Roe,2022-06-24T20:24:24Z,279291
85,4OnjP_ZHHao,Ben Shapiro,The CRAZIEST Leftist Reactions To Roe and Casey Being Overturned,Roe,2022-06-24T19:00:03Z,432164
86,w2rhyRQ5_zA,Ben Shapiro,Ben Shapiro REACTS to Biden's Remarks on Roe v Wade Being Overturned,Roe,2022-06-24T18:30:53Z,458620
87,h8P7b3WF5no,Ben Shapiro,LIVE: Ben Shapiro Reacts to SCOTUS Ruling on Abortion,Abortion,2022-06-24T17:04:05Z,740374
88,mEOnY4dugKc,Ben Shapiro,"""This Is Just The Beginning"": Lila Rose and Ben Shapiro React to Roe v. Wade Being Overturned",Roe,2022-06-24T17:00:35Z,114096
89,qZFKU32JsuU,Ben Shapiro,Joe Biden’s Gas Problem | Ep. 1521,Gas,2022-06-23T17:00:09Z,208869
90,m8QixpEQF4s,Ben Shapiro,Is Biden Going To Win On Gun Control?,Gun,2022-06-22T22:30:03Z,163929
91,TudMlddmerM,Ben Shapiro,The Left LIES About Taxing The Rich,Rich,2022-06-22T19:00:10Z,119277
92,UkPXHWdZ3jY,Ben Shapiro,"Debunked: ""The Rich Don’t Pay Their Fair Share""",Rich,2022-06-19T19:30:02Z,275763
93,GDhosImtiTM,Ben Shapiro,Joe Biden Is Running The Economy Into An Iceberg | Ep. 1515,Economy,2022-06-15T17:00:11Z,224533
94,nPcgvIMBv-A,Ben Shapiro,Biden’s Bear Market Arrives | Ep. 1514,Market,2022-06-14T17:00:08Z,231640
95,-WilR1fWzmY,Ben Shapiro,"""Tom Cruise May Be The Last True Movie Star"" | Ben Shapiro Reviews “Top Gun: Maverick” [SPOILERS]",Gun,2022-05-28T18:24:20Z,1507570
96,OCJpgUuFcf0,Ben Shapiro,Inflation Is The Saddest Song,Inflation,2022-05-27T00:30:04Z,905546
97,MHg4CPmnqow,Ben Shapiro,Why We Need To Stop Politicizing Mass Shootings,Shooting,2022-05-25T23:45:01Z,126169
98,g4t6xHU6J3Y,Ben Shapiro,Everything You Need To Know About The Tragic Uvalde Shooting,Shooting,2022-05-25T22:43:18Z,466098
99,eNglv-w9OlY,Ben Shapiro,The Vicious Political Manipulation of Another Evil School Shooting | Ep. 1502,Shooting,2022-05-25T17:00:11Z,286927
100,EEfG_0acVf0,Ben Shapiro,Blaming Tucker Carlson For Mass Shootings | Ep. 1496,Shooting,2022-05-17T17:00:08Z,323972
101,GzhRDppjpFU,Ben Shapiro,Here's What The Media Is Saying About The Buffalo Shooting,Shooting,2022-05-16T23:30:02Z,172319
102,IA1-_QGNSkc,Ben Shapiro,Everything You Need To Know About The Tragic Buffalo Shooting,Shooting,2022-05-16T22:09:30Z,331290
103,QEW3Pves_BM,Ben Shapiro,Everyone I Don’t Like Is Responsible For Mass Shootings | Ep. 1495,Shooting,2022-05-16T17:00:11Z,288874
104,rIMagrezinw,Ben Shapiro,Dems Bet Big On Abortion | Ep. 1490,Abortion,2022-05-09T17:00:10Z,270903
105,AmtsDxktx68,Ben Shapiro,SUPERCUT: Ben Shapiro's BEST Arguments Against Abortion,Abortion,2022-05-08T16:30:01Z,587142
106,Cm3BhXQtbLc,Ben Shapiro,INSANE: Dem Lawmakers MELTDOWN Over Roe v. Wade Being Overturned,Roe,2022-05-05T00:30:07Z,125237
107,3etTNuhtMho,Ben Shapiro,Here’s Exactly What Overturning Roe v. Wade Would ACTUALLY Do,Roe,2022-05-04T23:25:27Z,215406
108,Sa4ij1FVbCY,Ben Shapiro,The Left’s Abortion Meltdown | Ep. 1487,Abortion,2022-05-04T17:00:12Z,276592
109,qNS1chtkiX4,Ben Shapiro,Ben Shapiro Breaks Down LEAKED Supreme Court Draft Decision On ABORTION,Abortion,2022-05-03T20:51:56Z,443702
110,YxRezJiZHE8,Ben Shapiro,Is Roe About To Be Overturned?! |  Ep. 1486,Roe,2022-05-03T17:00:11Z,343662
111,FxbHHfI3-AQ,Ben Shapiro,Joe Biden's Crashing Economy |  Ep. 1483,Economy,2022-04-28T17:00:12Z,206820
112,RhLbz5hGwjc,Ben Shapiro,“MYSTERIES” of the Biden Family Riches REVEALED,Rich,2022-04-28T14:49:46Z,61836
113,SOUXgnXHxoE,Ben Shapiro,Climate Change Is NOT An Emergency — Here Are The Facts,Climate,2022-04-14T00:00:07Z,745753
114,JuhH_ru1AUI,Ben Shapiro,Shapiro Breaks Down HORRIFYING Statistics Showing MASSIVE Inflation,Inflation,2022-04-12T22:16:33Z,114371
115,57E86DjKDDo,Ben Shapiro,Ben Shapiro DEBUNKS Celebrity Abortion Arguments,Abortion,2022-04-02T16:00:04Z,869684
116,U3Mg30xp16w,Ben Shapiro,This Is What COVID Hysteria Is Doing to Our Children,Covid,2022-03-26T17:00:31Z,428049
117,zaNpAAubt98,Ben Shapiro,The Federal Reserve Just Made the WORST Decision in Attempt to Slow Inflation,Inflation,2022-03-17T23:56:54Z,118178
118,fe5wVWrLAlg,Ben Shapiro,LOL: Biden Administration Can't Answer Questions About RISING Gas Prices,Gas,2022-03-12T00:53:02Z,210444
119,uEALf2I-9b0,Ben Shapiro,Here’s Why Biden Is to Blame for Insanely High Gas Prices,Gas,2022-03-11T00:30:19Z,293502
120,DsetH7jBLj0,Ben Shapiro,Joe Biden’s Gas Problem |  Ep. 1449,Gas,2022-03-10T22:35:31Z,84510
121,g7rn_74UG-s,Ben Shapiro,WATCH: Trump Predicted Biden's Rising Gas Prices,Gas,2022-03-09T23:33:10Z,211447
122,JvUmxPGMpc4,Ben Shapiro,INSANE: Biden’s HORRIBLE Plan to Lower Gas Prices,Gas,2022-03-09T00:00:06Z,152376
123,KZJm-Bt4rSs,Ben Shapiro,Shapiro Breaks Down the Causes of Inflation,Inflation,2022-03-08T21:17:53Z,479177
124,I1cKHzjv15k,Ben Shapiro,How Biden's Foreign Policy Decisions Will Affect the U.S. Economy,Economy,2022-03-04T00:07:05Z,78059
125,lAazJOk6e-I,Ben Shapiro,Shapiro REACTS to SNL's Insane COVID Hypocrisy Skit,Covid,2022-03-01T03:00:13Z,777168
126,S4UaolRwqig,Ben Shapiro,Democrats Are Changing Their Stance on COVID – Here’s Why.,Covid,2022-02-09T00:30:03Z,259011
127,foydspxRJ0s,Ben Shapiro,The Left Blames Joe Rogan for COVID Deaths,Covid,2022-02-08T00:41:45Z,125177
128,VRVvFlvgoo4,Ben Shapiro,Biden Is Changing His COVID Strategy – But It’s Way Too Late,Covid,2022-02-05T00:30:05Z,294583
129,Cupgb8HL0W0,Ben Shapiro,The Biden Economy Hits The Skids | Ep. 1422,Economy,2022-01-28T18:00:10Z,252170
130,6jXhqTz-iDg,Ben Shapiro,Bari Weiss Is Right About the Dems' Awful COVID Policies. Here’s Why.,Covid,2022-01-25T01:00:01Z,187134
131,lFWjcY-palw,Ben Shapiro,LOL: AOC Gives Ridiculous COVID Message,Covid,2022-01-19T00:24:44Z,730514
132,QBTfYrRcwDI,Ben Shapiro,Inflation Hits FASTEST RATE Since 1982,Inflation,2022-01-14T01:00:05Z,88581
133,IiEiZEMM_0s,Ben Shapiro,Shapiro Breaks Down CDC Director's SHOCKING Covid Admission,Covid,2022-01-11T01:00:04Z,237699
134,EbCib0-30S8,Ben Shapiro,INSANE: 100 BILLION Dollars Stolen From COVID Relief Programs,Covid,2021-12-24T00:30:04Z,185688
135,TzgaTnKrs5w,Ben Shapiro,How The West’s Covid Policy Betrayed The Young | Ep. 1395,Covid,2021-12-14T18:00:10Z,194129
136,86TTArblYFc,Ben Shapiro,Abortion Is an Attack on Women. Here’s Why.,Abortion,2021-12-14T03:30:01Z,212219
137,DBBIJd9tlOE,Ben Shapiro,New York City’s New School COVID Policies Are INSANE,Covid,2021-12-14T01:00:02Z,137763
138,EiOOkTNPZes,Ben Shapiro,THIS Is How Biden’s Poor Economy Is Impacting Average Americans,Economy,2021-12-13T23:31:40Z,72318
139,EiOOkTNPZes,Ben Shapiro,THIS Is How Biden’s Poor Economy Is Impacting Average Americans,Poor,2021-12-13T23:31:40Z,72318
140,WadvtSAKoAY,Ben Shapiro,When Will The Biden Inflation Bubble Burst? | Ep. 1394,Inflation,2021-12-13T18:00:10Z,270352
141,IMCuTPiZCVM,Ben Shapiro,"Origins of the Daily Wire, Trump’s 2024 Plans, and Country Music | Ben Shapiro & John Rich",Rich,2021-12-11T15:00:08Z,260963
142,JsamOi5dbvQ,Ben Shapiro,INSANE: California Plans to Become ABORTION SANCTUARY,Abortion,2021-12-10T00:00:04Z,116193
143,jQzyV4pl3gk,Ben Shapiro,"Shapiro REACTS to COVID Christmas Song by Megan Thee Stallion, Ariana Grande, & Jimmy Fallon",Covid,2021-12-07T23:18:01Z,439847
144,EW4ua6_I4XY,Ben Shapiro,LUNACY: Leftist Justifies ABORTION by Citing the “Trauma” of ADOPTION,Abortion,2021-12-04T01:00:05Z,134132
145,Y4Dpx5X3cuI,Ben Shapiro,LOL: Democrats Celebrate Gas Prices Dropping by TWO CENTS,Gas,2021-12-03T23:30:03Z,219344
146,ICQc_oP6pLo,Ben Shapiro,The Abortion Fanatics Prepare For The Apocalypse | Ep. 1388,Abortion,2021-12-03T18:00:11Z,272380
147,r6RtFVm1cDI,Ben Shapiro,Ben Shapiro Breaks Down the Supreme Court Abortion Case,Abortion,2021-12-03T00:25:01Z,169015
148,J9q4-G5-xqg,Ben Shapiro,Is Roe About To Go? | Ep. 1387,Roe,2021-12-02T18:00:08Z,301940
149,sB1ukPf5axg,Ben Shapiro,LOL: Joe Biden FALLS ASLEEP At Climate Conference,Climate,2021-11-13T23:00:33Z,1934995
150,l2oXHzxcoEQ,Ben Shapiro,WEAK: Prosecutor Tries to Link CALL OF DUTY to Kyle Rittenhouse Shootings,Shooting,2021-11-11T23:16:09Z,267294
151,vPXONCA1wmE,Ben Shapiro,INSANE: Biden Nominee Wants to BANKRUPT Oil Companies to Stop Climate Change,Climate,2021-11-10T23:35:12Z,85395
152,obbGU-X2axI,Ben Shapiro,Man Shot by Kyle Rittenhouse ADMITS He Pulled His Gun on Kyle FIRST,Gun,2021-11-09T23:06:30Z,400568
153,bDBF_R2mmik,Ben Shapiro,Shapiro Reacts to AWFUL SNL Abortion Skit,Abortion,2021-11-09T02:30:13Z,721131
154,-8hGOaaHWvw,Ben Shapiro,Biden Is Making Illegal Immigrants Rich And Americans Dependant | Ep. 1365,Immigration,2021-10-29T17:00:11Z,287350
155,-8hGOaaHWvw,Ben Shapiro,Biden Is Making Illegal Immigrants Rich And Americans Dependant | Ep. 1365,Rich,2021-10-29T17:00:11Z,287350
156,L1ia1AK6YNE,Ben Shapiro,Is the Tide Turning on the Abortion Issue?,Abortion,2021-10-27T21:00:23Z,44588
157,LnBq47OXQYM,Ben Shapiro,The Consequences Of Covid Authoritarianism | Ep. 1357,Covid,2021-10-19T17:00:11Z,252363
158,jVGM4dRvkEg,Ben Shapiro,LOL: Shapiro DISMANTLES Biden's Claim That He's DEFEATING COVID,Covid,2021-10-16T00:30:05Z,193959
159,k-vBYa7hMPk,Ben Shapiro,Shapiro Reacts to Joe Rogan Confronting CNN's Medical Expert on COVID,Covid,2021-10-14T22:10:56Z,1250515
160,U7_KnSfx9zw,Ben Shapiro,Unemployment Is SKYROCKETING Because of COVID Panic,Unemployed,2021-10-11T21:44:01Z,192067
161,U7_KnSfx9zw,Ben Shapiro,Unemployment Is SKYROCKETING Because of COVID Panic,Covid,2021-10-11T21:44:01Z,192067
162,4ouL2z9RcwA,Ben Shapiro,WOW: New Yorkers Think The Rich Should Be Taxed at 95%,Rich,2021-10-09T22:00:03Z,3595076
163,EqM_Sa4E_vM,Ben Shapiro,Authoritarian Biden Is Murdering The Economy | Ep. 1350,Economy,2021-10-08T17:00:11Z,255760
164,rofPmYg-J8o,Ben Shapiro,Climate Change PANIC! Shapiro and Lomborg Discuss the FALSE Media Narrative Around Global Warming,Climate,2021-09-29T17:00:34Z,147022
165,uK5rRaV_T4E,Ben Shapiro,Much Needed GOOD News About COVID,Covid,2021-09-25T00:30:08Z,424871
166,ntszS8DMTmM,Ben Shapiro,Biden Shoots The Horses | Ep. 1342,Shooting,2021-09-24T17:00:10Z,250466
167,hfFxQ3LY9-A,Ben Shapiro,The Economy Might Be in Jeopardy. Here’s Why.,Economy,2021-09-23T22:24:21Z,220528
168,2WjtBD5G-oU,Ben Shapiro,Shapiro EXPOSES AOC and The Left’s INSANE COVID Hypocrisy,Covid,2021-09-21T00:00:00Z,232648
169,H5sYQUQMSBk,Ben Shapiro,OUTRAGEOUS: Biden Cuts LIFE-SAVING COVID Treatment From Florida,Covid,2021-09-17T23:30:01Z,232734
170,8ke755mBOis,Ben Shapiro,"Mike Pence on Covid, Afghanistan, and American Freedom",Covid,2021-09-16T17:00:04Z,175922
171,FLGgOvpRlf0,Ben Shapiro,"Shapiro Reacts to AOC's Hypocritical ""Tax the Rich"" Designer Dress",Rich,2021-09-14T22:36:25Z,386676
172,Uhe4XCpEMBo,Ben Shapiro,WATCH: Biden BLAMES Republican Governors for COVID Deaths,Covid,2021-09-10T23:00:08Z,190006
173,UbBwTODoH8k,Ben Shapiro,The Covid Tyrant | Ep. 1335,Covid,2021-09-10T17:00:11Z,372896
174,vsfAdsUBU5Q,Ben Shapiro,We Are NOT Complying With Biden's New COVID Mandate,Covid,2021-09-10T14:48:32Z,984575
175,lAE0GBPQY_M,Ben Shapiro,Ben Shapiro on Abortion: Evil Is Still Evil Regardless of Politics,Abortion,2021-09-08T20:26:57Z,16617230
176,I7MNCav8UGo,Ben Shapiro,Shapiro ENDS Leftist’s Arguments Against Texas Abortion Law,Abortion,2021-09-04T01:00:02Z,528872
177,SYrYJlmp_Yk,Ben Shapiro,Biden’s Economy Just Got A LOT Worse...,Economy,2021-09-03T23:30:04Z,228454
178,OPOtk40XPoc,Ben Shapiro,Shapiro Breaks Down MAJOR WIN Against Abortion,Abortion,2021-09-02T23:30:06Z,362055
179,Az6HekxE4N0,Ben Shapiro,The Holy Sacrament Of Abortion | Ep. 1332,Abortion,2021-09-02T17:00:09Z,266920
180,EO_f4iB8jto,Ben Shapiro,Australia's COVID Lockdown Rules Are Completely INSANE,Covid,2021-08-24T22:20:26Z,769637
181,ocNNzwbd6Yk,Ben Shapiro,The U.S. is About to Make the Taliban Very Rich. Here's How.,Rich,2021-08-19T23:30:02Z,180388
182,jNHSJYZnedY,Ben Shapiro,Barack’s Very Covid Birthday Party | Ep. 1314,Covid,2021-08-09T17:00:11Z,244380
183,Px8ZyXnZbXc,Ben Shapiro,Biden Blames Florida For COVID Surge — Ron DeSantis Hits Back,Covid,2021-08-06T15:44:33Z,455629
184,OBIZfww5Z8w,Ben Shapiro,BUSTED: DC Mayor CAUGHT Breaking Her Own COVID Rules,Covid,2021-08-03T00:30:03Z,116058
185,NgM_THfc5S8,Ben Shapiro,The Covid Misinformation Is Coming From Inside The White House | Ep. 1307,Covid,2021-07-29T17:00:10Z,275606
186,8tVh_x_kBc4,Ben Shapiro,WATCH: Joe Biden FRUSTRATED By Tough COVID Question,Covid,2021-07-27T22:33:14Z,229177
187,1KuSQkqn-aM,Ben Shapiro,EXPLOSIVE: Rand Paul & Fauci CLASH in Tense COVID Debate,Covid,2021-07-21T22:41:06Z,447911
188,eYHp3v-5hXU,Ben Shapiro,Inflation under the Biden admin is even worse than you thought...,Inflation,2021-07-20T22:31:20Z,167458
189,Ss346PZFtNw,Ben Shapiro,The Endless Covid Power Grab | Ep. 1300,Covid,2021-07-20T17:00:10Z,247540
190,6bjnClayvJw,Ben Shapiro,The PURE HYPOCRISY Of Biden Admin TURNING AWAY Cuban Refugees,Refugee,2021-07-16T00:30:01Z,102255
191,pS9F3aRotf0,Ben Shapiro,Shapiro RIPS Dems for Claiming Cuba Revolt Is About COVID,Covid,2021-07-13T22:43:31Z,144342
192,wXET3CcHZnw,Ben Shapiro,OOPS: Biden's POOR Mental Performance GETS NOTICED,Poor,2021-07-12T23:15:30Z,466843
193,XsmEfOaU5Xc,Ben Shapiro,Poll Reveals Democrat Policies Are EXTREMELY UNPOPULAR,Extremism,2021-06-29T01:00:04Z,181570
194,xf7DvreEuD8,Ben Shapiro,‘Hands Up Don’t Nuke’: Biden RIPPED Over INSANE Gun Remarks,Gun,2021-06-25T01:01:46Z,282049
195,K6FVKaG5jco,Ben Shapiro,Old Joe Isn’t Afraid To Nuke All You Gun Nuts | Ep. 1283,Gun,2021-06-24T17:00:09Z,298474
196,nS4Qv0YC6kU,Ben Shapiro,INFLATION: How Money-Printing & President Biden Impact Your Wallet,Inflation,2021-06-19T16:38:20Z,425234
197,oEAzF_-rzuo,Ben Shapiro,Biden Domestic Terror Plan Will Include ‘Anti-Radicalization’ Training For Retiring Military,Terrorism,2021-06-16T22:44:11Z,122365
198,kOaF8wMnVus,Ben Shapiro,Ben Shapiro Explains the Beauty of the Free Market,Market,2021-06-06T21:00:12Z,155202
199,RPbII0BhvzE,Ben Shapiro,Shapiro Reveals The 3 Keys To Escaping Generational Poverty,Poverty,2021-06-06T13:00:08Z,267900
200,fG5uAQdeMRI,Ben Shapiro,Shapiro Answers: How Can You Be Pro-Life AND Pro-Gun?,Pro-life,2021-05-31T19:00:16Z,506357
201,G_GhfBh1h6Y,Ben Shapiro,Biden Struggles To Read The Teleprompter As Inflation SKYROCKETS,Inflation,2021-05-16T00:00:03Z,918106
202,YfQT-uxb-7I,Ben Shapiro,INSANE INFLATION: Biden MISSING After Setting Everything ON FIRE,Inflation,2021-05-13T14:19:59Z,207715
203,dO25tpTZjIw,Ben Shapiro,CRAP SHOW: Biden's Gas SHORTAGE And Other Disasters,Gas,2021-05-11T22:51:00Z,438634
204,vKBzoF1C6Dg,Ben Shapiro,Biden Is Already Wrecking The Economy | Ep. 1253,Economy,2021-05-10T17:00:13Z,324256
205,vortmlz4gq8,Ben Shapiro,Inflation Is On The Horizon | Biden's INSANE Spending Problem,Inflation,2021-05-06T01:00:08Z,193818
206,lFlly9blI7s,Ben Shapiro,New Footage The Media Won't Show You From The Ma’Khia Bryant Shooting,Shooting,2021-04-23T21:57:38Z,569393
207,e7uUbElygf0,Ben Shapiro,Shapiro RIPS The Left's Reaction To Ma'Khia Bryant Shooting,Shooting,2021-04-22T22:45:01Z,725616
208,wxVLpnyln-A,Ben Shapiro,"CNN Director: We Worked To Oust Trump, Use ‘Fear’ To Pass Climate Agenda",Climate,2021-04-15T14:30:58Z,287790
209,1J195g0y41A,Ben Shapiro,Shapiro Weighs In On Daunte Wright Shooting,Shooting,2021-04-13T23:36:28Z,698120
210,pIXocXkLSJM,Ben Shapiro,Biden UNLEASHES Executive Action On Gun Control,Gun,2021-04-10T15:50:35Z,282459
211,xAaagsvG0YY,Ben Shapiro,Ben Shapiro and Piers Morgan Revisit Their Viral Gun Control Debate,Gun,2021-04-10T12:00:20Z,1909276
212,BBaedNDwdSg,Ben Shapiro,Ben Shapiro DISMANTLES Obama's Gun Control Arguments,Gun,2021-03-25T15:37:28Z,336342
213,-AGomwUuPvY,Ben Shapiro,Biden Considering Gun Control EXECUTIVE ACTION,Gun,2021-03-24T21:04:18Z,313822
214,Itn_-bHZ2H4,Ben Shapiro,The Left’s Lies About “Whiteness” And Gun Control | Ep. 1222,Gun,2021-03-24T17:00:15Z,226624
215,Z-KHmADt8Q4,Ben Shapiro,Ten Killed In Tragic Colorado Mass Shooting,Shooting,2021-03-23T21:56:38Z,406672
216,2JGnK1dSvlg,Ben Shapiro,"""If You Don't Back Gun Control, It's Because You Don't Care"" | Ep. 1221",Gun,2021-03-23T17:00:16Z,230162
217,mxJTx4U6DAs,Ben Shapiro,The Industries CRUSHED By Covid,Covid,2021-03-18T21:52:45Z,169294
218,yjGJ4OIqtfI,Ben Shapiro,"This Radical Activist Just Called The COVID Vaccine A ""Vial Of Death""",Covid,2021-03-04T22:09:48Z,680154
219,Z7gmYArepOc,Ben Shapiro,Gov. Ron DeSantis Contrasts Florida's COVID Response to New York's,Covid,2021-03-04T01:19:44Z,266850
220,_0QkAplTlJI,Ben Shapiro,"Biden's GARBAGE COVID Agenda, His TEAM OF LIARS, And The ASININE CDC",Covid,2021-02-20T16:00:09Z,373908
